,time,headline,stock
0,3/7/2025 2:41:09 PM,Unusually active option classes on open March 7th,vz
1,3/7/2025 2:00:00 PM,Verizon to speak at Deutsche Bank Conference March 11,vz
2,3/6/2025 3:38:41 PM,Verizon tells customers to put the phone down.,vz
3,3/5/2025 11:01:48 AM,"Commerce Department plans changes to broadband grant program, WSJ reports",vz
4,3/5/2025 6:01:00 AM,"Verizon adds new partners Singtel, Skylo to worldwide IoT platform",vz
5,3/4/2025 1:15:09 PM,AST SpaceMobile’s Q4 Earnings: Did They Answer the Big Three Questions?,vz
6,3/3/2025 7:49:10 PM,Top 10 highest dividend yielding U.S. stocks with market caps greater than $10B,vz
7,3/3/2025 2:36:22 PM,Verizon price target raised to $48 from $47.50 at Scotiabank,vz
8,3/3/2025 10:36:04 AM,"Verizon, Accenture partner on advanced cybersecurity solutions",vz
9,3/3/2025 8:00:00 AM,Verizon Announces Strategic Partnership with Accenture to Help Organizations Tackle Emerging Cybersecurity Threats,vz
10,3/2/2025 2:15:13 PM,"Lockheed Martin, Nokia, Verizon advance defense capabilities through collab",vz
11,2/28/2025 9:44:56 PM,Verizon declares quarterly dividend on February 28,vz
12,2/28/2025 9:00:25 PM,Verizon declares $0.6775 dividend,vz
13,2/28/2025 8:00:04 PM,"Catalyst Watch: Tariff reality, Target earnings volatility, and the February jobs report",vz
14,2/28/2025 5:00:00 PM,Verizon to speak at Morgan Stanley TMT Conference March 4,vz
15,2/28/2025 7:59:33 AM,Verizon’s (VZ) DEI Practices Under FCC Scrutiny amid $9.6B Frontier Deal,vz
16,2/27/2025 7:07:02 PM,SpaceX May Benefit if FAA Cancels Its $2B Contract with Verizon (VZ),vz
17,2/27/2025 4:42:27 PM,The Value of Virtualized Architecture in High-Density Environments,vz
18,2/27/2025 3:10:18 PM,Verizon announces new savings & VIP benefits for customers who bring together Mobile & Home,vz
19,2/27/2025 2:30:54 PM,"Verizon announces converged offer for Mobile, Home Internet customers",vz
20,2/27/2025 11:46:16 AM,"Viavi, AT&T and Verizon team to accelerate testing of Open RAN",vz
21,2/27/2025 11:26:02 AM,"FAA targeting Verizon contract in favor of Musk’s Starlink, WaPo reports",vz
22,2/26/2025 6:04:05 PM,Verizon (NYSE:VZ) Rolls Out New Upload Speed Record,vz
23,2/26/2025 4:00:00 PM,Verizon sets new 5G upload speed record as it continues to advance its network to manage AI and other emerging workloads,vz
24,2/25/2025 8:07:20 PM,"Verizon infuses AI in the network, accelerates Open RAN innovation with multi-vendor RAN Intelligent Controller deployment",vz
25,2/25/2025 3:30:00 PM,Verizon Business launches turnkey IoT solution with Atlanta Hawks as first customer,vz
26,2/25/2025 2:52:55 PM,Verizon Business announces Atlanta Hawks as launch partner for Sensor Insights,vz
27,2/25/2025 10:41:20 AM,Allot Ltd. partners with Verizon Business on enhanced cybersecurity protection,vz
28,2/25/2025 5:12:47 AM,Musk’s SpaceX to Integrate Starlink Terminals in U.S. FAA’s Airspace Network,vz
29,2/24/2025 4:00:00 PM,Verizon completes its first satellite to cellular enabled video call with AST SpaceMobile BlueBird 2,vz
30,2/21/2025 5:42:32 PM,Upgrade to iPhone 16e and save with incredible offers from Verizon,vz
31,2/20/2025 5:00:00 PM,Verizon to speak at Barclays Symposium February 25,vz
32,2/20/2025 2:30:00 PM,"Verizon Innovative Learning reaches 8.5 million students, adds 34 schools for 2025-2026 school year",vz
33,2/20/2025 1:35:17 PM,Verizon Innovative Learning reaches 8.5M students,vz
34,2/19/2025 11:43:18 AM,"Analysts Conflicted on These Communication Services Names: News Corp (NWSA), Verizon (VZ) and Liberty Global A (LBTYA)",vz
35,2/14/2025 2:00:00 PM,"Verizon to redeem debt securities on March 18, 2025",vz
36,2/11/2025 4:59:15 PM,Verizon powers winning network experience on Super Bowl Sunday,vz
37,2/11/2025 3:00:00 PM,Verizon has the best 5G network in America,vz
38,2/10/2025 7:21:58 AM,Super Bowl Spotlight: T-Mobile and SpaceX’s Starlink Kick Off Satellite Beta Service,vz
39,2/5/2025 2:55:27 PM,Trump Trade: USPS resumes shipments of China parcels,vz
40,2/5/2025 10:50:11 AM,"Trump picks broadband expansion plan critic to oversee program, Bloomberg says",vz
41,2/4/2025 3:05:00 PM,Verizon adds another epic deal for mobile and home customers with Google One AI Premium,vz
42,2/4/2025 2:16:06 PM,Verizon announces addition of first AI perk from wireless provider,vz
43,2/4/2025 9:54:10 AM,"AST SpaceMobile (ASTS) Partners with Telecom Giants, Highlighting Its Growth Potential",vz
44,2/3/2025 10:14:58 PM,"Verizon Foundation provides $500,000 to support wildfire recovery efforts in Southern California",vz
45,2/3/2025 9:55:57 PM,Verizon FanFests “Sold Out” with 100K+ Tickets Claimed,vz
46,1/31/2025 6:00:00 PM,Fresh Start After the Storm: Verizon Erases $10M in Debt for Western North Carolina Families with ForgiveCo,vz
47,1/31/2025 4:30:00 PM,Verizon conquers remaining Dead Zones through Satellite with help of Test Man and Buzz Aldrin,vz
48,1/31/2025 10:43:12 AM,"AST SpaceMobile stock jumps after FCC approves testing with AT&T, Verizon",vz
49,1/30/2025 6:15:51 PM,"Verizon’s Growth Potential: Strong Subscriber Growth, AI Opportunities, and Strategic Initiatives Drive Future Success",vz
50,1/30/2025 12:21:09 PM,T-Mobile price target raised to $275 from $255 at Benchmark,vz
51,1/29/2025 2:30:00 PM,U.S. Coast Guard Awards Verizon Business $66 Million Enterprise Infrastructure Solutions Task Order,vz
52,1/29/2025 9:50:40 AM,Verizon upgraded to Hold from Sell at DZ Bank,vz
53,1/28/2025 6:00:00 PM,Verizon Frontline delivering 5G connectivity to New York State Police cruisers,vz
54,1/28/2025 3:00:00 PM,Verizon Connect debuts new technology solutions for fleet safety and compliance,vz
55,1/28/2025 2:21:46 PM,"Verizon Connect debuts technology solutions for fleet safety, compliance",vz
56,1/28/2025 8:57:25 AM,Verizon’s Strong Dividend Yield and 5G Investments Drive Buy Rating,vz
57,1/27/2025 6:35:04 PM,Argus Research Keeps Their Buy Rating on Verizon (VZ),vz
58,1/27/2025 5:28:55 PM,"AT&T increasing investment in AI, plans to return $40B over 3 years",vz
59,1/27/2025 3:15:31 PM,Verizon price target raised to $47.50 from $47 at Scotiabank,vz
60,1/27/2025 2:00:50 PM,Verizon price target raised to $44 from $42 at Evercore ISI,vz
61,1/27/2025 1:00:49 PM,"Analysts Offer Insights on Communication Services Companies: Twilio (TWLO), Verizon (VZ) and Match Group (MTCH)",vz
62,1/27/2025 12:53:05 PM,AT&T's bundled plans drives better-than-expected subscriber growth,vz
63,1/27/2025 12:20:12 PM,Analysts Offer Insights on Communication Services Companies: Verizon (VZ) and Meta Platforms (META),vz
64,1/27/2025 12:10:20 PM,"Analysts Have Conflicting Sentiments on These Communication Services Companies: Verizon (VZ), Meta Platforms (META) and Interpublic Group of Companies (IPG)",vz
65,1/27/2025 12:02:09 PM,"Analysts Offer Insights on Communication Services Companies: Spotify Technology SA (SPOT), Verizon (VZ) and Electronic Arts (EA)",vz
66,1/27/2025 11:45:38 AM,Verizon price target lowered to $46 from $48 at Bernstein,vz
67,1/27/2025 11:36:21 AM,Verizon (VZ) Receives a Hold from RBC Capital,vz
68,1/27/2025 10:55:06 AM,Wells Fargo Reaffirms Their Hold Rating on Verizon (VZ),vz
69,1/27/2025 9:37:28 AM,KeyBanc Keeps Their Hold Rating on Verizon (VZ),vz
70,1/24/2025 10:45:11 PM,Verizon’s Strong Performance and Strategic Initiatives Earn a Buy Rating from Analyst Gregory Williams,vz
71,1/24/2025 5:05:34 PM,"Boeing provides downbeat pre-announcement, Verizon reports Q4 beat: Morning Buzz",vz
72,1/24/2025 2:40:19 PM,Unusually active option classes on open January 24th,vz
73,1/24/2025 2:30:00 PM,Verizon unveils AI strategy to power next-gen AI demands,vz
74,1/24/2025 2:11:06 PM,"4 stocks to watch on Friday: BA, AXP and more",vz
75,1/24/2025 2:10:35 PM,Verizon expects to see gradual improvements in device upgrade rates in 2025,vz
76,1/24/2025 2:01:51 PM,Morning Movers: American Express and Verizon trend higher following Q4 results,vz
77,1/24/2025 2:01:07 PM,Verizon sees increasing demand for AI Connect offerings,vz
78,1/24/2025 1:45:35 PM,Verizon sees Frontier deal closing in early 2026,vz
79,1/24/2025 1:41:16 PM,Verizon posts results beat for fourth quarter; sets fresh targets for 2025,vz
80,1/24/2025 1:40:38 PM,"Verizon says “confident” Fios, FWA will continue to grow market share in 2025",vz
81,1/24/2025 1:35:43 PM,Verizon sees ‘strong’ momentum going into 2025,vz
82,1/24/2025 1:35:34 PM,Verizon Business unveils Verizon AI Connect suite of solutions,vz
83,1/24/2025 1:35:10 PM,Verizon sees FY25 total wireless service revenue growth 2%-2.8%,vz
84,1/24/2025 12:55:00 PM,Verizon delivered strong customer growth and profitability in 2024,vz
85,1/24/2025 12:28:24 PM,Verizon in charts: Wireless equipment revenues +40% Q/Q in Q4,vz
86,1/24/2025 12:16:07 PM,"Earnings Snapshot: Verizon Communications reports strong Q4 performance, tops revenue estimates",vz
87,1/24/2025 12:06:21 PM,Verizon reports Q4 wireless service revenue up 3.1% to $20B,vz
88,1/24/2025 12:05:52 PM,"Verizon reports Q4 broadband net additions of 408,000",vz
89,1/24/2025 12:01:07 PM,"Verizon reports Q4 adjusted EPS $1.10, consensus $1.10",vz
90,1/24/2025 12:00:51 PM,Verizon sees FY25 adjusted EPS growth 0%-3%,vz
91,1/24/2025 12:00:35 PM,Verizon sees FY25 adjusted EBITDA growth 2%-3.5%,vz
92,1/24/2025 11:57:03 AM,"Verizon Non-GAAP EPS of $1.10 in-line, revenue of $35.7B beats by $360M",vz
93,1/23/2025 11:00:08 PM,Here's the major earnings before the open tomorrow,vz
94,1/23/2025 7:00:14 PM,Notable companies reporting before tomorrow’s open,vz
95,1/23/2025 4:46:56 PM,"Verizon, AT&T Q4 earnings Preview: Focus on subscriber growth, capital spending",vz
96,1/23/2025 3:00:00 PM,Verizon Frontline delivers FDNY a critical communications upgrade,vz
97,1/23/2025 2:10:18 PM,Verizon Frontline completes communications upgrade for FDNY,vz
98,1/22/2025 6:55:00 PM,Your new Galaxy S25 awaits: Verizon offers epic deals for new and current customers,vz
99,1/22/2025 5:00:00 PM,"Verizon to report earnings January 24, 2025",vz
100,1/22/2025 3:18:04 AM,Evercore ISI Sticks to Their Hold Rating for Verizon (VZ),vz
101,1/21/2025 1:55:07 PM,Verizon (VZ) Gets a Hold from Bank of America Securities,vz
102,1/19/2025 1:12:00 PM,"Earnings week ahead: JNJ, NFLX, AAL, UAL, AXP, ABT, VZ, PG, and more",vz
103,1/18/2025 6:05:00 PM,14 out of 20 names post earnings beat with blockbuster wins from banks-Earnings Scorecard,vz
104,1/17/2025 8:00:19 PM,"Catalyst Watch: Netflix earnings, Monster Beverage event, drug data, and quantum volatility",vz
105,1/17/2025 11:20:36 AM,Analysts Offer Insights on Communication Services Companies: Verizon (VZ) and Interpublic Group of Companies (IPG),vz
106,1/16/2025 1:40:08 AM,Analysts Offer Insights on Communication Services Companies: Verizon (VZ) and Warner Bros (WBD),vz
107,1/10/2025 7:05:25 PM,Verizon says nation-state threat actor accessed Verizon network,vz
108,1/10/2025 4:35:43 PM,Verizon Foundation donates $1 Million towards Southern California wildfire and windstorm relief efforts,vz
109,1/9/2025 6:36:17 PM,Verizon named a Leader in first-ever 2025 Gartner® Magic Quadrant™ for Private Mobile Network Services,vz
110,1/9/2025 5:58:41 PM,Verizon offers relief to customers impacted by the Southern California Wildfires and Windstorm,vz
111,1/9/2025 12:56:04 AM,Verizon’s Southern California wildfire response,vz
112,1/8/2025 7:36:08 PM,Craig-Hallum starts Adtran with a Buy amid global fiber investments,vz
113,1/7/2025 3:30:00 PM,Verizon shatters speed barriers with 5.5 Gbps breakthrough,vz
114,1/7/2025 3:00:00 PM,Verizon selected by the U.S. Air Force for 5G and network upgrades at 35 installations,vz
115,1/7/2025 2:10:18 PM,"Verizon selected by USAF for 5G, network upgrades at 35 installations",vz
116,1/6/2025 11:15:18 AM,T-Mobile downgraded to Equal Weight from Overweight at Wells Fargo,vz
117,1/5/2025 11:05:11 PM,"China’s hackers worked deeper inside U.S. telecom networks, WSJ reports",vz
118,1/3/2025 4:30:13 PM,Verizon announces first-ever “Super Bowl FanFest” bringing a Super Bowl LIX experience to 30 NFL cities across the country,vz
119,1/3/2025 2:30:00 PM,Verizon announces first-ever “Super Bowl FanFest” bringing a Super Bowl LIX experience to 30 NFL cities across the country,vz
120,1/3/2025 1:40:28 PM,Verizon announces ‘Super Bowl FanFest’,vz
121,1/2/2025 7:39:31 PM,"Verizon to report 4Q earnings January 24, 2025",vz
122,1/2/2025 5:15:34 PM,"Appeals court blocks Biden administration’s net neutrality rules, Reuters says",vz
123,1/2/2025 3:00:00 PM,Verizon Frontline showcases advanced communications solutions at EDGE25,vz
124,12/31/2024 5:05:32 PM,"CompoSecure to spin off Resolute, EHang raises Q4 revenue view; Morning Buzz",vz
125,12/30/2024 7:40:16 PM,"AT&T, Verizon, say they have secured networks after breaches, TC reports",vz
126,12/30/2024 5:00:35 PM,"Boeing slips after Jeju Air crash, HashiCorp-IBM draws review: Morning Buzz",vz
127,12/29/2024 12:05:05 PM,"AT&T, Verizon targeted by Salt Typhoon cyberespionage operation, Reuters says",vz
128,12/24/2024 12:04:57 PM,All eyes on Netflix as Christmas NFL games take the spotlight,vz
129,12/19/2024 8:45:52 PM,Lumen jumps on report of wireline assets potential sale (update),vz
130,12/19/2024 8:00:00 PM,Verizon Frontline powers NORAD Tracks Santa initiative for 22nd year,vz
131,12/18/2024 9:00:00 PM,Verizon Frontline Crisis Response Team supports 800+ agencies during 2024 emergency responses,vz
132,12/17/2024 3:30:00 PM,Verizon Collaborates with NVIDIA to Power AI Workloads on 5G Private Networks with Mobile Edge Compute,vz
133,12/17/2024 2:35:40 PM,"Verizon, Nvidia collaborate to power AI workloads on 5G Private Networks",vz
134,12/17/2024 10:55:49 AM,Verizon’s Mixed Signals: Hold Rating Amid Stable Competition and Revenue Growth Challenges,vz
135,12/17/2024 12:56:39 AM,Verizon’s Hold Rating: Balancing 5G Opportunities Against Consumer Growth Challenges,vz
136,12/12/2024 11:20:14 AM,Analysts Offer Insights on Communication Services Companies: Verizon (VZ) and Match Group (MTCH),vz
137,12/11/2024 7:00:00 PM,Verizon redefines clear connections on-the-go with the launch of Enhanced Video Calling,vz
138,12/10/2024 3:00:00 PM,Verizon Amps Up the Concert Experience: Superfast Connections for Superfans,vz
139,12/10/2024 2:45:24 PM,"eBay downgraded, GM upgraded: Wall Street’s top analyst calls",vz
140,12/10/2024 2:00:00 PM,Verizon announces expiration and final results of its tender offers for six series of debt securities,vz
141,12/9/2024 9:45:25 PM,Verizon initiated with a Market Perform at Bernstein,vz
142,12/9/2024 9:35:47 PM,Verizon initiated with a Market Perform at Bernstein,vz
143,12/6/2024 1:22:00 PM,"Dividend Roundup: Disney, Microsoft, Dell Technologies, Alphabet, and more",vz
144,12/5/2024 6:31:05 PM,Daniel H. Schulman elected as Verizon lead director,vz
145,12/5/2024 5:51:06 PM,Verizon declares quarterly dividend on December 5,vz
146,12/5/2024 4:53:41 PM,Verizon declares $0.6775 dividend,vz
147,12/5/2024 3:00:00 AM,EBARA Corporation Deploys Cyber Monitoring and Intelligence Capabilities Powered by Verizon Business,vz
148,12/4/2024 11:25:10 PM,"Verizon raises administrative fee to $3.50 per month, Android Police says",vz
149,12/4/2024 5:00:00 PM,Verizon Chairman & CEO Hans Vestberg to speak at UBS Global Media & Communications Conference Dec. 9,vz
150,12/4/2024 2:20:55 PM,Office Depot announces new agreement with Verizon for select retail locations,vz
151,12/3/2024 8:30:00 PM,Verizon Business caps off 2024 Innovation Sessions at SoFi Stadium in Los Angeles,vz
152,12/3/2024 6:08:51 PM,Verizon turns up the heat on savings with Holiday Deal Days,vz
153,11/27/2024 5:00:00 PM,"Verizon donates $25,000 in response to the Mountain Fire",vz
154,11/26/2024 3:00:00 PM,Verizon Frontline delivers critical connectivity during U.S. Capitol Christmas Tree Harvest,vz
155,11/25/2024 7:35:17 PM,"Verizon donates $25,000 in response to the major Pacific Northwest storm",vz
156,11/25/2024 5:10:25 PM,"Macy’s uncovers employee fraud, Summit to be acquired: Morning Buzz",vz
157,11/25/2024 2:30:00 PM,Verizon advances its fiber network for AI workloads,vz
158,11/25/2024 1:35:14 PM,Verizon advances fiber network for AI workloads,vz
159,11/25/2024 10:45:22 AM,"U.S. launches probe into Salt Typhoon hack after Microsoft alert, NYT reports",vz
160,11/22/2024 5:46:57 PM,Verizon announces accepted amounts and pricing terms of its tender offers for six series of debt securities,vz
161,11/22/2024 2:00:54 PM,Verizon announces early results for tender offers for six series of debt securities and extension of early participation date,vz
162,11/22/2024 3:38:14 AM,Verizon offers relief to customers impacted by the major Pacific Northwest storm,vz
163,11/21/2024 9:01:55 PM,FCC to undertake extensive review of submarine cables in more than two decades,vz
164,11/21/2024 3:41:14 PM,Verizon brings more joy and less stress to your holiday shopping experience,vz
165,11/21/2024 3:30:00 PM,Verizon Business secures new 5-year agreement with the U.S. Department of Agriculture (USDA),vz
166,11/21/2024 3:00:00 PM,Verizon deploys first-ever interoperable multi-vendor O-RAN DAS system,vz
167,11/21/2024 2:40:16 PM,Verizon Business secures five-year agreement with U.S. Department of Agriculture,vz
168,11/21/2024 2:05:29 PM,Verizon deploys interoperable multi-vendor O-RAN DAS system,vz
169,11/19/2024 5:28:00 PM,Analyst who predicted AT&T would ditch Nokia for network needs thinks T-Mobile US may follow suit,vz
170,11/19/2024 3:00:00 PM,Verizon announces Dejero as latest “Verizon Frontline Verified” partner,vz
171,11/19/2024 2:15:53 PM,Verizon anounces Dejero as ‘Verizon Frontline Verified’ partner,vz
172,11/18/2024 9:33:28 PM,Verizon statement on naming of Brendan Carr as FCC Chairman,vz
173,11/18/2024 8:45:53 PM,Verizon congratulates FCC Commissioner Carr on being named next Chairman,vz
174,11/18/2024 5:00:00 PM,Verizon to speak at Morgan Stanley European TMT Conference November 21,vz
175,11/18/2024 3:00:00 PM,"Verizon Connect report highlights fleet tech adoption, ROI gains, and safety improvements",vz
176,11/14/2024 9:56:24 PM,"Dan Loeb's Third Point enters Tesla, CVS, exits Uber, Verizon, among top Q3 trades",vz
177,11/14/2024 9:36:30 PM,"Third Point exits Alphabet, cuts stakes in Microsoft, Amazon, Meta, Apple",vz
178,11/14/2024 2:47:14 PM,Verizon Business enters partnership with Knightscope for connectivity,vz
179,11/13/2024 10:00:00 PM,Verizon partners with Knightscope to power connectivity for advanced public safety tech,vz
180,11/13/2024 9:11:24 PM,"Verizon, Knightscope team  to power connectivity for advanced public safety tech",vz
181,11/13/2024 3:23:01 PM,Frontier Communications gains as holders approve Verizon deal,vz
182,11/13/2024 3:21:01 PM,Frontier stockholders approve acquisition by Verizon,vz
183,11/12/2024 3:10:18 PM,Verizon Frontline delivers connectivity during North Carolina nuclear incident training exercise,vz
184,11/12/2024 3:00:00 PM,Verizon and Barbie® team up to turn the DreamHouse into the StreamHouse Powered by Verizon Home Internet – and you’re invited!,vz
185,11/12/2024 2:41:15 PM,Netflix says over 50% of new sign-ups for ads plan in ad-supported countries,vz
186,11/12/2024 2:20:35 PM,"Verizon, Barbie announce first-ever collaboration",vz
187,11/12/2024 2:20:10 PM,Verizon Frontline delivers connectivity during nuclear incident training,vz
188,11/11/2024 5:00:00 PM,"Verizon, ForgiveCo launch $3M Veteran Debt Relief Program to alleviate hardships for veterans this holiday season",vz
189,11/11/2024 3:00:00 PM,U.S. Department of Defense awards Verizon Business with contract extension,vz
190,11/11/2024 2:45:24 PM,Total Wireless partners with Puerto Rican boxer Amanda Serrano,vz
191,11/11/2024 2:11:52 PM,Verizon awarded contract extension from U.S. DoD,vz
192,11/8/2024 8:00:23 PM,"Catalyst Watch: Alibaba earnings, Disney drama, CPI print, 13F filings and more election scrambling",vz
193,11/8/2024 5:00:00 PM,Verizon remains ready amid the Mountain and Broad Fires,vz
194,11/7/2024 10:29:57 PM,"Frontier Comm holders should vote to abstain from Verizon vote, proxy advisers say",vz
195,11/7/2024 10:12:18 PM,"Frontier says it disagrees with ISS, Glass Lewis recommendations",vz
196,11/7/2024 10:01:04 PM,Verizon announces tender offers for six series of debt securities,vz
197,11/7/2024 6:00:00 PM,"Verizon Business, TriMet delivering advanced mass transit capabilities to Portland region",vz
198,11/7/2024 3:00:00 PM,The Samsung Galaxy S24 Enterprise Edition: Your business’ new workhorse,vz
199,11/7/2024 1:05:28 PM,U.S. Cellular to sell select spectrum assets to AT&T for $1.018B,vz
200,11/6/2024 4:36:07 PM,Stocks in Communication Services rise on investor optimism for sector under Trump's second term,vz
201,11/5/2024 9:37:16 PM,Frontier Communications not providing outlook due to pending Verizon deal,vz
202,11/5/2024 9:37:07 PM,Frontier Communications not providing outlook due to pending Verizon deal,vz
203,11/4/2024 2:51:09 PM,"Verizon will not raise Frontier Communications bid, CNBC says",vz
204,11/4/2024 2:49:01 PM,Verizon isn't going to raise Frontier Communications bid: CNBC,vz
205,11/4/2024 1:40:20 PM,Voip-Pal.com files motion for consolidation in U.S. District Court,vz
206,11/1/2024 5:49:26 PM,ISS reportedly told Frontier shareholders to abstain voting on the Verizon deal,vz
207,11/1/2024 4:20:12 PM,Frontier rises after ISS recommends abstain vote on Verizon deal,vz
208,11/1/2024 4:15:29 PM,"ISS recommends Frontier investors vote against Verizon deal, Bloomberg says",vz
209,11/1/2024 4:15:21 PM,Frontier jumps 1% after ISS recommends vote against Verizon deal,vz
210,10/31/2024 5:00:00 PM,Verizon and the East Side Mosquito Abatement District utilize technology to fight mosquitoes,vz
211,10/30/2024 2:00:00 PM,"Verizon and Wounded Warrior Project® partner to support at least 1,000 veterans with upskilling",vz
212,10/29/2024 12:36:06 PM,Verizon’s Strategic Growth and Strong Market Position Justify Buy Rating,vz
213,10/28/2024 7:55:09 PM,KeyBanc analysts hold an analyst/industry conference call,vz
214,10/28/2024 2:07:29 PM,Frontier Communications falls amid downgrade as higher bid seen unlikely,vz
215,10/28/2024 1:47:09 PM,"Coinbase initiated, Edwards Lifesciences upgraded: Wall Street’s top analyst cal",vz
216,10/28/2024 9:20:21 AM,Frontier downgraded to Market Perform from Strong Buy at Raymond James,vz
217,10/26/2024 5:46:00 PM,About 75% of companies that reported earnings this week delivered EPS wins-Earnings Scorecard,vz
218,10/25/2024 7:26:50 PM,Trump's campaign notified of a Chinese hack targeting their phones - NYT,vz
219,10/24/2024 5:23:10 PM,"KeyBanc cuts Verizon rating on decline of key metrics, limited growth going ahead",vz
220,10/24/2024 4:15:59 PM,"Boeing union rejects latest offer, Tesla reports Q3 beat: Morning Buzz",vz
221,10/24/2024 3:00:00 PM,Verizon Family app helps you keep your children safe and gives you peace of mind,vz
222,10/24/2024 2:01:15 PM,Verizon price target raised to $44 from $43 at UBS,vz
223,10/24/2024 1:45:30 PM,"Verizon downgraded, Canadian Pacific upgraded: Wall Street’s top analyst calls",vz
224,10/24/2024 1:10:42 PM,Verizon launches Verizon Family app,vz
225,10/24/2024 12:45:25 PM,"Verizon, AT&T wireless upgrade rates show improvement, but still tepid: Wells Fargo",vz
226,10/24/2024 8:40:30 AM,KeyBanc downgrades Verizon on limited room for EBITDA growth,vz
227,10/23/2024 9:35:52 PM,Frontier's biggest holder hires adviser to evaluate sale to Verizon - Bloomberg,vz
228,10/23/2024 8:41:32 PM,Verizon downgraded to Sector Weight from Overweight at KeyBanc,vz
229,10/23/2024 3:00:00 PM,Verizon Frontline Crisis Response Team introduces two new deployable assets,vz
230,10/23/2024 2:25:18 PM,Verizon price target lowered to $47 from $47.25 at Scotiabank,vz
231,10/23/2024 1:18:33 PM,Frontier Comm holder Glendon Capital calls for vote on Verizon deal to be delayed,vz
232,10/23/2024 1:11:20 PM,Verizon Frontlie launches two new deployable asset prototypes,vz
233,10/23/2024 12:54:50 PM,"AT&T adds more subs in Q3, posts profit beat and reaffirms forecast; shares rise",vz
234,10/23/2024 12:18:54 PM,Evercore ISI Keeps Their Hold Rating on Verizon (VZ),vz
235,10/23/2024 12:15:42 PM,Verizon price target raised to $44 from $43 at UBS,vz
236,10/23/2024 12:11:36 PM,Glendon Capital opposes Frontier Communications’ proposed sale to Verizon,vz
237,10/23/2024 11:56:31 AM,Oppenheimer Sticks to Its Buy Rating for Verizon (VZ),vz
238,10/23/2024 11:05:41 AM,Scotiabank Sticks to Their Hold Rating for Verizon (VZ),vz
239,10/23/2024 10:58:52 AM,RBC Capital Remains a Hold on Verizon (VZ),vz
240,10/23/2024 10:55:20 AM,Verizon’s Strategic Broadband Shift: Balancing Long-term Growth with Short-term Financial Impacts,vz
241,10/23/2024 10:45:56 AM,Verizon’s Strategic Investments Drive Long-Term Potential Amid Short-Term Financial Challenges: A Hold Rating,vz
242,10/23/2024 12:15:53 AM,Verizon’s Strategic Convergence and Growth Prospects Justify Buy Rating Despite Near-term Challenges,vz
243,10/22/2024 4:01:16 PM,"GE Aerospace, GM report quarterly earnings beats: Morning Buzz",vz
244,10/22/2024 3:12:22 PM,"Verizon updates broadband strategy to bring more choice, flexibility and value to millions",vz
245,10/22/2024 2:09:46 PM,"Biggest stock movers Tuesday: PM, GM, ZION, and more",vz
246,10/22/2024 1:40:16 PM,Unusually active option classes on open October 22nd,vz
247,10/22/2024 1:29:36 PM,Verizon Unveils Ambitious Broadband Expansion Plans,vz
248,10/22/2024 1:26:08 PM,Verizon updates broadbrand strategy with new fixed wireless subscriber goals,vz
249,10/22/2024 1:26:01 PM,Verizon targets 30M+ fiber passings by 2028,vz
250,10/22/2024 1:00:20 PM,"Verizon delivers strong third quarter results with customer growth in mobility, extending industry leadership",vz
251,10/22/2024 12:55:26 PM,Morning Movers: 3M gains and GE Aerospace falls following third quarter results,vz
