,time,headline,stock
1252,5/18/2023 3:15:17 PM,Verizon (VZ): New Buy Recommendation for This Technology Giant,vz
1253,5/17/2023 3:04:58 PM,Wall Street's Most Accurate Analysts Say Hold These 3 Tech And Telecom Stocks Delivering High-Dividend Yields,vz
1254,5/15/2023 7:01:44 PM,7 Safe ETFs to Shield Your Portfolio From Market Turmoil,vz
1255,5/10/2023 8:33:44 PM,Is ChatGPT A Better Financial Advisor? We're Going To Find Out,vz
1256,5/8/2023 12:30:00 PM,"Investor Movement Index creeps higher in April, still on 'moderate low' setting",vz
1257,5/8/2023 11:30:41 AM,7 Blue-Chip Stocks to Buy at an All-Time Low in May,vz
1258,5/4/2023 10:01:33 PM,7 Blue-Chip Stocks to Buy in May 2023,vz
1259,5/3/2023 8:17:26 PM,3 Sorry Blue-Chip Stocks to Sell in May Before It’s Too Late,vz
1260,5/3/2023 12:01:07 PM,"Globalstar pops as Morgan Stanley upgrades, says financing overhang 'removed'",vz
1261,5/1/2023 4:31:32 PM,"Analysts Conflicted on These Technology Names: Bumble (BMBL), L3Harris Technologies (LHX) and Verizon (VZ)",vz
1262,4/28/2023 1:07:00 PM,Thinking Of Buying Broadstone Net Lease? Here Are The Properties And Tenants You'd Be Adding To Your Portfolio,vz
1263,4/27/2023 10:00:17 PM,Verizon and AT&T Performance Woes Impact Charter Communications: Analyst Lowers Expectations,vz
1264,4/27/2023 9:54:12 PM,What's Driving Today's Communication Services Sector (XLC) Rally? 5 Stocks To Watch And What's Next,vz
1265,4/26/2023 11:00:50 PM,The Latest Analyst Ratings for Verizon Communications,vz
1266,4/26/2023 8:24:57 PM,Verizon's Free Cash Flow Struggles And Debt Challenges: Analyst Trims Expectations,vz
1267,4/26/2023 10:21:00 AM,"Analysts Have Conflicting Sentiments on These Technology Companies: Enphase Energy (ENPH), Raytheon Technologies (RTX) and Verizon (VZ)",vz
1268,4/26/2023 8:55:50 AM,Barclays Reaffirms Their Hold Rating on Verizon (VZ),vz
1269,4/26/2023 2:25:04 AM,Goldman Sachs Keeps Their Hold Rating on Verizon (VZ),vz
1270,4/25/2023 6:25:12 PM,3 Undervalued High-Yield Stocks to Buy,vz
1271,4/25/2023 11:16:18 AM,Verizon rises as it adds 633K subscribers in Q1,vz
1272,4/25/2023 10:52:05 AM,"Verizon reports Q1 Non-GAAP EPS of $1.20, revenue of $32.9B",vz
1273,4/24/2023 7:21:11 PM,The 3 Greatest Value Stocks to Buy Right Now,vz
1274,4/24/2023 6:15:09 PM,VZ earnings preview: Eyes on subscriber count,vz
1275,4/24/2023 2:24:40 PM,Notable earnings before Tuesday's open,vz
1276,4/24/2023 10:31:01 AM,"Analysts’ Opinions Are Mixed on These Technology Stocks: Rockwell Automation (ROK), Block (SQ) and Verizon (VZ)",vz
1277,4/24/2023 10:00:48 AM,3 Stocks to Buy for the Massive Real Estate Crash Ahead,vz
1278,4/21/2023 7:00:36 PM,"Catalyst watch: Earnings blitz, Mobileye lockup expiration and the new one-day VIX debut",vz
1279,4/21/2023 5:30:41 PM,"Earnings Week Ahead: Amazon, Meta Platforms, Alphabet, Coca-Cola, Boeing, and more",vz
1280,4/20/2023 4:54:19 PM,AT&T plunges 10% as Q1 free cash flow misses estimates despite mobile strength,vz
1281,4/19/2023 10:30:31 AM,The Top 7 Stocks to Buy for Income Investors,vz
1282,4/17/2023 5:40:35 PM,3 Dividend Stocks to Buy That Have a Strong ESG Profile,vz
1283,4/15/2023 6:04:55 PM,7 Dividend Stocks to Buy That Are Trading at a Discount,vz
1284,4/13/2023 2:54:47 PM,"FTX's Native Token Might Be Relaunched, Putin Personally Approved Arrest Of American Journalist Evan Gershkovich, Fox News-Dominion Voting Systems Trial To Start Monday: Today's Top Stories",vz
1285,4/6/2023 3:09:09 PM,"Morgan Stanley cuts Comcast, adds Becton Dickinson to its model portfolio",vz
1286,4/5/2023 6:58:56 PM,3 Dream Retirement Stocks You Don’t Want to Miss Out On,vz
1287,4/5/2023 10:30:58 AM,The 7 Most Undervalued Stocks to Buy in April 2023,vz
1288,4/4/2023 9:00:12 PM,"T-Mobile Analyst Sees Compelling Synergy, Operating Efficiencies Driving Growth, Capital Return",vz
1289,4/4/2023 5:25:32 PM,"KeyBanc Capital Markets Touts WOW And CMCSA, Cautions Patience On CHTR: Analysts Explain Why",vz
1290,4/4/2023 11:30:16 AM,"Analysts Offer Insights on Technology Companies: AeroVironment (AVAV), Verizon (VZ) and Schrodinger (SDGR)",vz
1291,3/29/2023 2:19:19 AM,3 Growth Stocks That Have a Loyal Customer Base,vz
1292,3/28/2023 7:19:00 PM,5 High-Yield Stocks for March 2023,vz
1293,3/28/2023 6:09:28 PM,7 Value Stocks To Buy Now For Bargain Prices,vz
1294,3/27/2023 7:35:28 PM,"Frontier's Premium Valuation Vs AT&T, Verizon And Fiber Growth Target Risks Trigger Downgrade By This Analyst",vz
1295,3/23/2023 9:00:39 PM,The Latest Analyst Ratings for Verizon Communications,vz
1296,3/23/2023 9:20:09 AM,"Analysts’ Top Technology Picks: Autodesk (ADSK), Boeing (BA)",vz
1297,3/21/2023 7:41:23 PM,"10 High Yield, Cheap Dividend Stocks To Buy Right Now",vz
1298,3/17/2023 8:01:24 AM,"Best Stocks to Beat the Market, 3/17/23",vz
1299,3/15/2023 5:49:20 PM,7 Dividend Stocks for a Reliable Stream of Income,vz
1300,3/13/2023 10:07:07 PM,7 Surefire Stocks With the Most Gangbuster Potential,vz
1301,3/12/2023 6:55:45 PM,7 Blue-Chip Stocks to Buy at an All-Time Low,vz
1302,3/10/2023 11:42:47 AM,"3 of the Best Dividend Stocks, According to Analysts—3/10/2023",vz
1303,3/9/2023 11:30:39 AM,7 Unloved Stocks That Deserve a Second Chance in 2023,vz
1304,3/6/2023 1:10:45 PM,Analysts Offer Insights on Technology Companies: Verizon (VZ) and Blackboxstocks (BLBX),vz
1305,3/6/2023 10:05:22 AM,Verizon (VZ): New Buy Recommendation for This Technology Giant,vz
1306,3/3/2023 2:26:05 PM,Wall Street's Most Accurate Analysts Say Buy These 3 Tech And Telecom Stocks With Over 3% Dividend Yields,vz
1307,3/2/2023 3:01:46 PM,Verizon declares $0.6525 dividend,vz
1308,2/28/2023 8:32:45 PM,7 Stocks to Buy at a Discount Now,vz
1309,2/28/2023 1:54:58 PM,DISH tumbles as BofA issues rare double downgrade on wireless worries,vz
1310,2/28/2023 11:30:12 AM,Stocks most and least liked by hedge funds and mutual funds -  Goldman,vz
1311,2/27/2023 11:19:06 PM,The 7 Best ETFs for Whatever Lies Ahead,vz
1312,2/27/2023 3:43:19 PM,"AIG names Diana Murphy, Vanessa Wittman to board",vz
1313,2/27/2023 1:57:14 PM,7 Dividend Stocks to Buy During a Market Downturn,vz
1314,2/27/2023 1:42:26 PM,3 High-Yield Dividend Stocks to Buy and Hold Forever ,vz
1315,2/24/2023 7:00:00 PM,"Catalyst watch: Tesla event, Microsoft talks OpenAI, Rivian earnings and Chevron",vz
1316,2/15/2023 3:01:23 PM,Check Out 3 High-Yielding Dividend Stocks In Tech & Telecom Sector From Wall Street's Most Accurate Analysts,vz
1317,2/10/2023 8:09:40 AM,Congresswoman Nicole Malliotakis Recently Traded This Telecom Stock,vz
1318,2/9/2023 7:16:42 PM,Apollo's Yahoo to lay off more than 20% of staff in digital ad strategy shift,vz
1319,2/7/2023 10:17:50 PM,"VZ, T, or TMUS: Which 5G Stock is the Best Pick in 2023?",vz
1320,2/2/2023 7:35:34 PM,The 7 Most Undervalued Dow Stocks to Buy in February 2023,vz
1321,1/28/2023 6:12:08 PM,7 Dividend Stocks to Buy Now or You’ll Be Kicking Yourself Later,vz
1322,1/28/2023 5:00:00 PM,"Tech Roundup: Microsoft, Intel lead latest parade of earnings results",vz
1323,1/27/2023 5:59:19 PM,5 Investors Betting Big on BuzzFeed (BZFD) Stock Right Now,vz
1324,1/27/2023 4:37:37 PM,3 Telecom Stocks That Will Be Big Winners in 2023,vz
1325,1/25/2023 7:07:57 PM,"Verizon Stock Is Holding Steady, But Analyst Sees Negative Trends Following Q4 Results & 2023 Guidance",vz
1326,1/25/2023 6:52:48 PM,AT&T hits six-month high as analysts see 'reset' in 2023 outlook,vz
1327,1/25/2023 5:01:14 PM,What 4 Analyst Ratings Have To Say About Verizon Communications,vz
1328,1/25/2023 4:27:25 PM,RBC Capital Keeps Their Hold Rating on Verizon (VZ),vz
1329,1/25/2023 4:27:18 PM,Verizon (VZ): New Buy Recommendation for This Technology Giant,vz
1330,1/25/2023 4:27:12 PM,"New Buy Rating for Verizon (VZ), the Technology Giant",vz
1331,1/25/2023 2:57:02 PM,"NYSE glitch caused by manual error, 4.3K trades declared void",vz
1332,1/25/2023 12:52:59 PM,AT&T climbs 6% as upbeat results outweigh light earnings forecast,vz
1333,1/24/2023 9:54:53 PM,AT&T earnings preview: It's all about the cash flow,vz
1334,1/24/2023 9:06:22 PM,"Dow, S&P 500, Nasdaq finish mixed as earnings season picks up steam",vz
1335,1/24/2023 8:55:52 PM,New York Stock Exchange system issue caused trading pauses at open,vz
1336,1/24/2023 8:53:48 PM,Dogs of the Dow 2023: 5 Dividend Stocks for Income Investors,vz
1337,1/24/2023 8:27:23 PM,Dow Rises 80 Points; Altamira Therapeutics Shares Plunge,vz
1338,1/24/2023 8:14:48 PM,"Nasdaq, S&P, Dow stumble after two-day win streak as earnings take spotlight",vz
1339,1/24/2023 7:43:46 PM,"AT&T Likely To Grow Volumes And Revenue Amid Cost Cuts, Analyst Says",vz
1340,1/24/2023 7:31:33 PM,Benzinga's Most Accurate Analysts Say Hold These 3 Tech & Telecom Stocks Delivering High-Dividend Yields,vz
1341,1/24/2023 7:31:32 PM,Verizon pulls off gain from results even as analysts see 'weak' 2023 outlook,vz
1342,1/24/2023 6:06:47 PM,Dow Edges Higher; Crude Oil Down 1%,vz
1343,1/24/2023 4:08:10 PM,Dow Drops 100 Points; Verizon Issues Weak Earnings Forecast,vz
1344,1/24/2023 3:08:57 PM,Unusually high number of stocks halted at NYSE open,vz
1345,1/24/2023 3:07:45 PM,Why Are Stocks Down Today?,vz
1346,1/24/2023 12:17:29 PM,"Verizon Non-GAAP EPS of $1.19 in-line, revenue of $35.3B beats by $160M",vz
1347,1/24/2023 12:15:58 PM,Verizon falls as outlook disappoints amid industry pressure,vz
1348,1/24/2023 10:02:31 AM,"Microsoft, Verizon Communications And 3 Stocks To Watch Heading Into Tuesday",vz
1349,1/24/2023 6:44:46 AM,7 Stocks to Buy as Inflation Fears Fade,vz
1350,1/23/2023 6:28:56 PM,Is Verizon set to close dismal 2022 with consumer subs growth in Q4?,vz
1351,1/23/2023 3:01:19 PM,Notable earnings before Tuesday's open,vz
1352,1/23/2023 3:01:13 PM,Here's what Wall Street expects from Verizon's earnings,vz
1353,1/22/2023 3:32:00 PM,"Streaming holds on as top TV use, though December brings more gaming",vz
1354,1/21/2023 1:58:53 AM,RBC Capital Keeps Their Hold Rating on Verizon (VZ),vz
1355,1/20/2023 7:30:11 PM,"Catalyst watch: Tesla reverberations, Intel earnings, Rocket Lab launch and Macau stocks on holiday",vz
1356,1/20/2023 5:16:36 PM,"Earnings week ahead: Tesla, Microsoft, AT&T and more",vz
1357,1/19/2023 7:38:23 PM,3 Top BlackRock Holdings You Can (and Should) Buy Now,vz
1358,1/17/2023 12:37:50 AM,7 Inflation-Fighting Stocks to Buy to Build Income Streams,vz
1359,1/13/2023 1:19:29 PM,7 Dividend-Paying Large-Cap Stocks to Buy in January,vz
1360,1/11/2023 5:38:25 PM,7 Under-the-Radar Growth Stocks With 10% Upside Potential,vz
1361,1/11/2023 1:43:21 PM,The 3 Best Dividend-Paying Telecom Stocks to Buy Now,vz
1362,1/10/2023 7:16:29 PM,7 Dividend-Paying Stocks Trading at a Discount,vz
1363,1/10/2023 11:34:49 AM,7 Warren Buffet Stocks to Buy and Hold for the Next Decade,vz
1364,1/8/2023 6:30:38 PM,The 7 Best Dividend Stocks to Buy for Your Grandkids in 2023,vz
1365,1/6/2023 6:20:23 PM,7 Cheap Blue-Chip Stocks to Buy Before They Rebound,vz
1366,1/4/2023 6:55:55 PM,7 Safe Stocks to Buy and Hold Forever,vz
1367,1/3/2023 7:20:31 PM,7 Must-Buy Dividend Stocks for Your January Buy List,vz
1368,12/28/2022 11:33:47 AM,7 Stocks to Buy as Infrastructure Spending Starts to Boom,vz
1369,12/27/2022 8:29:46 AM,3 High-Yield Dividend Stocks to Bolster Your Portfolio in January 2023,vz
1370,12/23/2022 5:34:51 PM,7 High-Yield Dividend Stocks to Buy Now,vz
1371,12/22/2022 10:05:52 PM,Big Telecom Stocks Look Undervalued after Avoiding FCC Fines,vz
1372,12/21/2022 7:46:44 PM,5 Stocking Stuffer Stocks for Christmas 2022,vz
1373,12/17/2022 3:30:00 PM,Streaming ramps up its share of TV usage in November,vz
1374,12/16/2022 7:01:12 PM,"Verizon With Stable And Notably Growing Dividend Likely To Beat Other TMT Names Against Macro Headwinds, Analyst Says",vz
1375,12/16/2022 2:30:28 PM,"Analysts Are Bullish on These Technology Stocks: Verizon (VZ), Climb Global Solutions (CLMB)",vz
1376,12/15/2022 8:35:06 PM,"AT&T's Stock Is 'Less Attractive' As Customer And Dividend Worries Mount, Analyst Says",vz
1377,12/15/2022 4:22:08 PM,Why This Verizon Communications Analyst Is Turning Bullish,vz
1378,12/15/2022 4:02:12 PM,"Benzinga's Top Ratings Upgrades, Downgrades For December 15, 2022",vz
1379,12/15/2022 4:32:55 AM,3 Top-Tier Dividend Stocks to Buy With 5%+ Yields,vz
1380,12/14/2022 6:48:52 PM,"Charter's Network Upgrade Impressive, While Capex Likely To Hurt FCF & Buybacks, Analysts Say",vz
1381,12/14/2022 4:52:39 PM,Charter dips 12% as analysts react to expensive network upgrade strategy,vz
1382,12/13/2022 11:39:28 PM,"A Career Politician Who Regularly Trades The SPY, Picked Up These 3 High Yielding ETFs Instead",vz
1383,12/13/2022 7:53:12 PM,Our Top 10 Stock Picks for 2023,vz
1384,12/13/2022 5:50:07 PM,2 Cell Tower REITs With Above-Average Yields: A Great Buy During Coveted Fed Pivot?,vz
1385,12/7/2022 7:25:43 PM,7 Big-Name Stocks Hedge Funds are Selling,vz
1386,12/5/2022 11:30:25 AM,7 Christmas Stocks to Buy for Happy Holidays,vz
1387,11/30/2022 8:49:37 PM,7 Excellent Dividend Stocks to Buy for the Holiday Season,vz
1388,11/24/2022 9:10:11 PM,Verizon vs. AT&T: Which Telecom Stock is Best?,vz
1389,11/23/2022 2:00:00 PM,"Black Friday Apple Deals: Get iPhone 14 Pro, and a gift, all on us and only at Verizon",vz
1390,11/21/2022 8:43:06 PM,4 No-Brainer Dividend Stocks for the End of 2022,vz
1391,11/17/2022 4:10:42 PM,"Switching to Verizon this holiday season, es una gran jugada",vz
1392,11/17/2022 3:30:00 PM,"Test drive the Network America Relies on and fly through our 5G lanes, no strings attached",vz
1393,11/17/2022 3:00:00 PM,Verizon and Nextdoor reveal the state of kindness in America,vz
1394,11/16/2022 3:57:20 PM,Traveling abroad this holiday season? Verizon keeps you connected with enhanced international options,vz
1395,11/15/2022 6:00:00 PM,"OpenLoop Health Partners with BlueJeans by Verizon to Expand Access to Quality, Reliable Virtual Visits",vz
1396,11/15/2022 1:00:00 PM,Verizon and Higi to extend community healthcare access and services ,vz
1397,11/14/2022 10:04:34 PM,7 Tried-and-True Income Stocks for November 2022,vz
1398,11/14/2022 4:30:00 PM,Small Businesses Turn to Digital Tools this Holiday Season,vz
1399,11/14/2022 2:00:00 PM,Verizon to speak at Morgan Stanley European TMT Conference November 16,vz
1400,11/11/2022 2:00:00 PM,Verizon to speak at NSR & BCG conference November 14,vz
1401,11/10/2022 5:06:56 PM,5 Cash-Rich Stocks to Buy to Resist the Fed,vz
1402,11/10/2022 2:00:00 PM,"Black Friday deals start early at Verizon with a gift for you and a gift to give, on us",vz
1403,11/8/2022 3:00:00 PM,Verizon expands relationship with MiCTA technology solutions purchaser,vz
1404,11/7/2022 7:29:59 PM,Berkshire Hathaway was a net buyer of stocks in Q3 to the tune of $3.7B,vz
1405,11/7/2022 7:07:37 PM,"As Subtropical Storm Nicole approaches Florida, Verizon is ready",vz
1406,11/7/2022 5:30:00 PM,Verizon Elects Vittorio Colao to Its Board of Directors,vz
1407,11/5/2022 1:00:23 PM,Dump These 10 Stocks Immediately,vz
1408,11/4/2022 2:13:02 PM,Verizon Stock (NYSE: VZ): A Huge Bargain for Dividend Investors,vz
1409,11/3/2022 6:14:40 PM,Dividend Corner: Is AT&T the right defensive safety stock to buy?,vz
1410,11/3/2022 2:00:00 PM,Verizon Business Takes 5G Innovation Sessions Series to New York City,vz
1411,11/1/2022 7:31:50 PM,3 High-Yield Dividend Stocks to Buy and Hold for Years,vz
1412,10/31/2022 2:00:00 PM,"Verizon Announces Partnership with Esports Company, World Champion Fantasy",vz
1413,10/28/2022 6:32:20 PM,T-Mobile rises 7% off subscriber beat-and-raise; other carriers gain,vz
1414,10/27/2022 9:00:00 PM,Verizon partners with Reset Digital and Yahoo to Drive Diverse Media Outcomes,vz
1415,10/27/2022 3:21:05 PM,Why the iPhone 14 Is Good News for Helium (HNT-USD),vz
1416,10/27/2022 3:06:13 PM,"Dear BBIG Stock Fans, Mark Your Calendars for Jan. 31",vz
1417,10/27/2022 3:03:40 PM,Introducing THREE more reasons to switch to Verizon Home Internet,vz
1418,10/24/2022 10:14:14 PM,Expert Ratings for Verizon Communications,vz
1419,10/24/2022 5:12:46 PM,Where Verizon Communications Stands With Analysts,vz
1420,10/24/2022 4:54:09 PM,Why These Verizon Communications Analysts Are Worried Despite Upbeat Q3,vz
1421,10/24/2022 4:16:11 PM,Why This AT&T Analyst Expects The Telecom To Outrun Verizon,vz
1422,10/24/2022 1:50:52 PM,American Express To Plunge Around 9%? Plus This Analyst Slashes PT On Verizon,vz
1423,10/24/2022 12:41:46 PM,Analysts Offer Insights on Technology Companies: Euronet Worldwide (EEFT) and Verizon (VZ),vz
1424,10/24/2022 12:27:40 PM,Investor Sentiment Improves Ahead Of Earnings Results,vz
1425,10/23/2022 4:02:00 PM,"Broadcast gets a sports bump, but streaming still holds TV usage crown",vz
1426,10/22/2022 4:00:00 PM,"Tech Roundup: Netflix, IBM lead start of tech earnings parade; Musk and Twitter continue on their march",vz
1427,10/21/2022 8:33:12 PM,Dow Jumps 650 Points; Gold Rises Over 1%,vz
1428,10/21/2022 7:08:51 PM,Nasdaq Surges 150 Points; Snap Shares Plunge,vz
1429,10/21/2022 4:18:43 PM,Verizon (NYSE:VZ) is on the Decline this Morning; Here’s Why,vz
1430,10/21/2022 4:02:09 PM,"Juniper Networks Has Upside Driven By New Router Wins Led By Verizon and Google, Analyst Says While Upgrading Stock",vz
1431,10/21/2022 3:54:32 PM,US Stocks Mostly Higher; Dow Jumps 200 Points,vz
1432,10/21/2022 3:29:34 PM,"Verizon sinks to 12-year low on Q3 results, subscriber issues",vz
1433,10/21/2022 2:55:24 PM,Veris Residential (VRE) Stock Soars 18% on Buyout Offer,vz
1434,10/21/2022 2:33:23 PM,Why Is Immunic (IMUX) Stock Down 76% Today?,vz
1435,10/21/2022 1:50:08 PM,Verizon (VZ) Stock Slumps Despite Earnings Beat,vz
1436,10/21/2022 1:37:53 PM,"Verizon hits new 52-week low as Q3 subscribers miss estimates, starts cost saving plan",vz
1437,10/21/2022 1:30:00 PM,Verizon reports 3Q results marked by revenue growth momentum,vz
1438,10/21/2022 11:31:25 AM,"Verizon Non-GAAP EPS of $1.32 beats by $0.03, revenue of $34.2B beats by $410M",vz
1439,10/20/2022 9:24:13 PM,"Verizon Prepaid launches new plan lineup, with unlimited data at best price yet",vz
1440,10/20/2022 7:06:21 PM,What to watch in Verizon earnings: Can it break subscriber exodus?,vz
1441,10/20/2022 5:50:57 PM,"AT&T gains 8% as analysts like solid beat, but note work to do on cash flow",vz
1442,10/20/2022 3:14:02 PM,Notable earnings before Friday's open,vz
1443,10/20/2022 3:01:13 PM,Verizon earnings preview: what Wall Street is expecting,vz
1444,10/20/2022 2:00:00 PM,The Galaxy XCover6 Pro brings rugged business performance to Verizon,vz
1445,10/20/2022 1:00:00 PM,"Verizon to report earnings October 21, 2022",vz
1446,10/20/2022 11:14:44 AM,"AT&T rises as Q3 earnings top estimates, adds 964K total subscribers",vz
1447,10/20/2022 1:47:56 AM,RBC Capital Sticks to Its Hold Rating for Verizon (VZ),vz
1448,10/19/2022 7:53:51 PM,AT&T weighing multibillion-dollar fiber joint venture - Bloomberg,vz
1449,10/19/2022 3:00:00 PM,"Verizon Business to Launch Multi-Session, Multi-Day Events with BlueJeans Expo",vz
1450,10/18/2022 4:00:00 PM,Verizon’s +play adds NBA streaming services,vz
1451,10/18/2022 3:30:00 PM,Verizon Improves In-Office Engagement with BlueJeans Gateway for Microsoft Teams,vz
1452,10/18/2022 3:25:30 PM,The 10 Best Dow Jones Stocks to Buy Before the Market Recovers,vz
1453,10/18/2022 3:00:00 PM,Verizon’s Call Filter Gets an Upgrade,vz
1454,10/18/2022 2:00:00 PM,Verizon UC and CX study finds major disconnect between management assumptions and employee expectations,vz
1455,10/17/2022 10:24:11 PM,Do Tech Stocks Pay High Dividends? These 2 Yielders Surpass Their Peers,vz
1456,10/17/2022 6:30:00 PM,Verizon Business Takes 5G Innovation Sessions Series to Los Angeles,vz
1457,10/17/2022 6:00:00 PM,Verizon Frontline survey highlights need for a fast and reliable network,vz
1458,10/17/2022 3:00:00 PM,STRAIGHT TALK WIRELESS PARTNERS WITH WALMART TO DELIVER AFFORDABLE HOME INTERNET,vz
1459,10/15/2022 7:55:00 PM,Verizon and Razer unveil Razer Edge 5G — the ultimate 5G handheld gaming device,vz
1460,10/14/2022 6:30:00 PM,"Catalyst Watch: Tesla, Netflix, Fisker, TechCrunch Disrupt and Paris Motor Show headline big week",vz
1461,10/14/2022 5:10:04 PM,"Earnings week ahead: Tesla, Netflix, Johnson & Johnson, AT&T and more",vz
1462,10/13/2022 7:36:38 PM,"Verizon donates $250,000 in support of small business recovery in wake of hurricane",vz
1463,10/13/2022 5:00:00 PM,Verizon moves commercial traffic onto its 5G core,vz
1464,10/13/2022 2:30:00 PM,Verizon Connect Reveal is now available on GSA contracts,vz
1465,10/12/2022 8:00:00 PM,Verizon Frontline introduces newest first responder advisory council member,vz
1466,10/12/2022 3:18:40 PM,7 Telecom Stocks to Sell Before They Die,vz
1467,10/12/2022 11:03:35 AM,Strong dollar will be the new earnings excuse; these stocks look insulated,vz
1468,10/11/2022 6:00:00 PM,Verizon announces organization evolution to accelerate efficiency and growth,vz
1469,10/11/2022 3:34:28 PM,7 Risky Stocks to Watch as Q3 Earnings Kicks Off,vz
1470,10/10/2022 4:29:34 PM,Verizon launches new tech to monitor activity on home WiFi ,vz
1471,10/10/2022 4:20:23 PM,Verizon extends customer offer to Florida counties hardest hit by Hurricane Ian through Oct. 31,vz
1472,10/9/2022 1:41:09 PM,7 Blue-Chip Stocks That Are Too Cheap to Ignore,vz
1473,10/8/2022 2:02:00 PM,"Communications names log solid week, led by revived Twitter deal",vz
1474,10/7/2022 10:38:18 PM,3 Under-$10 Stocks to Buy to Tap Into a Hidden Bull Market,vz
1475,10/7/2022 8:00:01 PM,Telecom Analysts Expect T-Mobile To Lead The Pack,vz
1476,10/7/2022 3:23:48 PM,Constellation Brands To Rally 21%? Plus Wells Fargo Predicts $225 For Visa,vz
1477,10/7/2022 12:40:41 PM,"Analysts Conflicted on These Technology Names: Verizon (VZ), Clarivate (CLVT) and Accolade (ACCD)",vz
1478,10/6/2022 8:47:59 PM,"Verizon With Stable & Growing Dividend Likely To Hold In Far Better Than Peer TMTs, Analyst Says",vz
1479,10/6/2022 6:11:42 PM,Oppenheimer reverses to upgrade Verizon as subscriber base improves,vz
1480,10/6/2022 4:55:00 PM,"Preorders are alive! Get your Google Pixel 7, 7 Pro and Pixel Watch on Verizon",vz
1481,10/6/2022 4:25:48 PM,"Benzinga's Top Ratings Upgrades, Downgrades For October 6, 2022",vz
1482,10/6/2022 3:30:00 PM,Verizon expands free Home Internet program to help bridge digital divide,vz
1483,10/6/2022 2:13:00 PM,"With earnings on tap, tech titans like Microsoft and Intel are coming off 52-week-lows",vz
1484,10/6/2022 1:10:00 PM,Verizon Business to Deploy Extreme Networks Solutions at Liverpool Anfield Stadium,vz
1485,10/6/2022 12:31:02 PM,"Analysts Offer Insights on Technology Companies: Meta Platforms (META), Verizon (VZ) and I3 Verticals (IIIV)",vz
1486,10/5/2022 5:50:02 PM,Verizon Frontline deploys more assets for Hurricane Ian’s first responders,vz
1487,10/5/2022 2:30:00 PM,Verizon lands $1.58B Task Order from Dept. of State to modernize U.S. embassies,vz
1488,10/4/2022 7:27:39 PM,Verizon Connect named #1 in innovation by ABI Research,vz
1489,10/4/2022 3:59:36 PM,Verizon extends customer offer to Florida counties hardest hit by Hurricane Ian,vz
1490,10/3/2022 7:43:30 PM,3 Low-Volatility Dividend Stocks for Turbulent Markets,vz
1491,10/3/2022 7:38:45 PM,Verizon providing free charging/wifi to residents impacted by Hurricane Ian,vz
1492,10/3/2022 10:30:35 AM,The 7 Best 5G Stocks to Buy Now for the Long Haul,vz
1493,10/1/2022 7:08:23 PM,Verizon deploys additional 5G Ultra Wideband to help with Hurricane Ian recovery,vz
1494,9/30/2022 9:16:30 PM,Verizon expands relief to customers hardest hit by Hurricane Ian,vz
1495,9/30/2022 8:27:17 PM,Verizon makes donation to support disaster recovery efforts in Florida,vz
1496,9/29/2022 7:07:24 PM,13 Analysts Have This to Say About Verizon Communications,vz
1497,9/29/2022 6:05:58 PM,Analyst Ratings for Verizon Communications,vz
1498,9/29/2022 4:08:03 PM,What 13 Analyst Ratings Have To Say About Verizon Communications,vz
1499,9/29/2022 2:43:50 PM,UBS Slashes PT On This Stock By Over 89%? Plus Evercore ISI Group Predicts $150 For First Solar,vz
1500,9/29/2022 10:15:47 AM,The 3 Best Telecom Stocks to Buy Now,vz
1501,9/28/2022 7:25:00 PM,Verizon unveils the future of 5G home entertainment during Mobile World Congress keynote,vz
1502,9/28/2022 7:25:00 PM,Verizon brings NFL+ to +play platform,vz
1503,9/28/2022 3:00:00 PM,Verizon and Nextdoor reveal the most impactful acts of kindness in the community,vz
1504,9/28/2022 1:00:00 PM,Verizon Business Takes 5G Innovation Sessions Series to Boston,vz
1505,9/28/2022 11:30:00 AM,"Lockheed Martin, Verizon demonstrate 5G-connected ISR Capabilities for Department of Defense",vz
1506,9/28/2022 12:48:36 AM,Verizon offers relief to customers  likely to be hardest hit by Hurricane Ian,vz
1507,9/27/2022 10:17:15 PM,Verizon Presents Fantasy Flashback: This Week’s Most Reliable Players in Partnership with Yahoo Sports,vz
1508,9/27/2022 7:37:30 PM,AutoZone To Rally 11%? Plus This Analyst Slashes PT On FedEx By 50%,vz
1509,9/27/2022 6:50:42 PM,7 Dow Stocks to Buy to Tap Into a Hidden Bull Market,vz
1510,9/27/2022 3:57:27 PM,Where Verizon Communications Stands With Analysts,vz
1511,9/27/2022 12:35:29 PM,Credit Suisse Remains a Hold on Verizon (VZ),vz
1512,9/26/2022 2:30:00 PM,Verizon Connect introduces new EV features for Reveal,vz
1513,9/26/2022 2:00:00 PM,"As Tropical Storm Ian approaches the US, Verizon is ready",vz
1514,9/23/2022 8:34:26 PM,Verizon supports recovery efforts across communities in Puerto Rico,vz
1515,9/22/2022 8:36:19 PM,Fios customers can watch WAPA América and Televisión Dominicana for free following Hurricane Fiona,vz
1516,9/22/2022 3:31:40 PM,Verizon to build private 5G network in an aircraft hangar at Joint Base Pearl Harbor Hickam,vz
1517,9/22/2022 3:30:00 PM,Verizon becomes first corporate drone program awarded IS-BAO registration,vz
1518,9/22/2022 3:00:00 PM,"Philadelphia and Washington D.C. among new areas to get new Internet options from Verizon, the network America relies on",vz
