,time,headline,stock
2573,12/4/2020 10:14:00 PM,"Discovery Communications, LLC -- Moody's says Discovery's launch of global streaming service, Discovery+, is credit positive",vz
2574,12/4/2020 9:00:00 PM,Verizon to speak at UBS Global TMT Conference December 7,vz
2575,12/4/2020 5:43:19 PM,7 Hot Stocks Only Getting Hotter As Winter Approaches,vz
2576,12/4/2020 12:08:21 PM,Nokia Stock Looks Like It Won’t Be Going Anywhere for a While,vz
2577,12/3/2020 6:53:56 PM,12.03.20: Verizon declares quarterly dividend,vz
2578,12/3/2020 6:06:04 PM,Verizon declares $0.6275 dividend,vz
2579,12/3/2020 3:00:00 PM,Verizon continues to lead industry in fight against robocalls,vz
2580,12/2/2020 11:36:52 PM,More than $1B in TV sports rebates headed back to consumers after pandemic's lost year,vz
2581,12/2/2020 8:05:26 PM,"If Analysts Don’t Have Conviction For Nokia, Why Should You?",vz
2582,12/2/2020 8:05:26 PM,"If Analysts Don’t Have Conviction For Nokia, Why Should You?",vz
2583,12/2/2020 6:43:13 PM,"Discovery Plus streaming service to launch Jan. 4, with originals and 55,000-plus library shows",vz
2584,12/2/2020 5:28:57 PM,Verizon gains as MoffettNathanson sees 'simply too cheap' stock,vz
2585,12/2/2020 2:36:54 PM,Discovery launching streaming service in January at $4.99/month - CNBC,vz
2586,12/1/2020 4:10:32 PM,"AT&T, Verizon put SportsNet Pittsburgh back on FiOS with new deal",vz
2587,12/1/2020 4:02:20 PM,Verizon Media ConnectID jumps in as unified ID solution for ad targeting,vz
2588,12/1/2020 4:00:00 PM,Verizon Media Launches Unified ID Solution “Verizon Media ConnectID”,vz
2589,12/1/2020 2:00:00 PM,AT&T SportsNet returns to Verizon Fios,vz
2590,11/30/2020 9:19:39 PM,"Verizon supports remote learning in New York City with $43M commitment, impacting 39,000 students",vz
2591,11/30/2020 5:07:00 PM,United States Cellular Corporation -- Moody's assigns Ba1 to US Cellular unsecured notes,vz
2592,11/30/2020 3:00:00 PM,Verizon to speak at Wells Fargo TMT Summit December 1,vz
2593,11/26/2020 6:56:00 AM,CSAIL 2018-C14 Commercial Mortgage Trust -- Moody's affirms seven classes of CSAIL 2018-C14,vz
2594,11/25/2020 2:47:15 PM,Verizon wins FTC antitrust OK for $6.25B Tracfone acquisition,vz
2595,11/24/2020 6:51:10 PM,"Verizon, NYC settle long dispute with deal to expand broadband access",vz
2596,11/24/2020 6:16:06 PM,How 5G Is Changing the Landscape for Nokia,vz
2597,11/24/2020 3:00:00 PM,Unwrap the hottest tech deals for Black Friday and all holiday season long at Verizon,vz
2598,11/21/2020 11:31:29 PM,"As network providers fight over Gs, few consumers demanding highest speeds",vz
2599,11/20/2020 9:18:11 PM,Verizon expands 5G Ultra Wideband service to Akron and Nashville,vz
2600,11/20/2020 6:14:50 PM,3 Infrastructure Stocks Building to the Upside,vz
2601,11/20/2020 4:00:00 PM,Verizon 5G Ultra Wideband service available in more cities,vz
2602,11/20/2020 1:06:50 PM,3 Reasons to Avoid Nokia Stock as It Loses Steam in the 5G Race,vz
2603,11/19/2020 8:35:03 PM,Apple and Verizon partner on 5G Fleet Swap program to upgrade enterprises to iPhone 12 models,vz
2604,11/19/2020 7:05:00 PM,Verizon Media and BuzzFeed Announce New Strategic Partnership Across Content and Advertising,vz
2605,11/19/2020 7:00:00 PM,Verizon Business deploys 5G Ultra Wideband indoors at General Motors and Honeywell,vz
2606,11/19/2020 6:11:05 PM,Verizon Media selling HuffPost to BuzzFeed in stock deal,vz
2607,11/19/2020 5:38:37 PM,3 5G Stocks to Stream Profits into Your Portfolio in 2021,vz
2608,11/19/2020 3:00:00 PM,"Verizon is home for gamers: get a 5G phone, PlayStation Plus and PlayStation Now on us",vz
2609,11/19/2020 2:00:00 PM,Retailers unite behind A Call For Kindness this holiday season,vz
2610,11/18/2020 5:00:00 PM,Verizon Innovative Learning expands to offer 3M+ teachers free tools for digital education,vz
2611,11/18/2020 4:00:00 PM,Verizon Business Retail Trends Report finds online shopping traffic up 82%,vz
2612,11/18/2020 3:23:57 PM,"As It Flags in the 5G Race, Nokia Stock Is in for a Very Long Winter",vz
2613,11/18/2020 3:17:43 PM,"Verizon Public Sector provides next-gen video surveillance and analytics for cities, public safety",vz
2614,11/18/2020 2:00:00 PM,"Verizon to redeem debt securities on December 18, 2020",vz
2615,11/17/2020 6:48:07 PM,Verizon and Snap Inc. debut first-ever 5G Landmarker Lens,vz
2616,11/17/2020 6:37:30 PM,Nokia Is Still Trying to Find Its 5G Groove,vz
2617,11/17/2020 4:00:00 PM,Verizon Business 5G Innovation Hub in Lake Nona to Explore 5G-Enabled Solutions Across a Number of Industries,vz
2618,11/17/2020 3:30:00 PM,Verizon puts the best streaming content in one place with next-gen Stream TV,vz
2619,11/16/2020 10:00:00 PM,Verizon to speak at Morgan Stanley European TMT Conference November 18,vz
2620,11/16/2020 9:02:28 PM,"Wells Fargo resumes coverage of wireless, picking a winner in the 5G stakes",vz
2621,11/16/2020 5:50:07 PM,Verizon Business to Host First-Ever Joint Virtual Event with Apple for Enterprise Customers,vz
2622,11/13/2020 7:44:10 PM,3 Low-Risk Strategies To Begin Investing In 5G Stocks,vz
2623,11/13/2020 6:05:40 PM,7 Value Stocks That Could Make You the Next Warren Buffett,vz
2624,11/12/2020 6:56:01 PM,BlueJeans by Verizon and RightsTrade transform entertainment licensing experience,vz
2625,11/11/2020 8:30:00 PM,Verizon and AWS Expand Mobile Edge Computing Platform to Dallas and Miami,vz
2626,11/11/2020 4:39:30 PM,Verizon Communications Is Fairly Valued and a Safe Play,vz
2627,11/11/2020 1:39:03 PM,Oil’s rally keeps chugging with shorts wrong-footed: At the Open,vz
2628,11/10/2020 10:00:00 PM,Verizon to webcast November 11 analyst meeting,vz
2629,11/10/2020 3:30:00 PM,Verizon Business debuts Business Internet Secure to protect small businesses,vz
2630,11/10/2020 3:00:00 PM,Verizon joins the World Economic Forum’s Trillion Trees Platform,vz
2631,11/10/2020 2:40:00 PM,Verizon Communications Inc. -- Moody's says Verizon's debt issuance does not impact rating or positive outlook,vz
2632,11/9/2020 3:30:00 PM,"Verizon Media and Walmart’s One-of-a-Kind ""30 Days of Savings"" Campaign Returns",vz
2633,11/9/2020 3:13:53 PM,Buy Nokia Stock for the Long-Term 5G Growth Ahead,vz
2634,11/6/2020 9:55:21 PM,The 3 Big Market Events From This Week,vz
2635,11/6/2020 8:30:45 PM,Seeking Alpha Catalyst Watch,vz
2636,11/6/2020 7:10:21 PM,Nokia Stock Remains a Deep-Value Investor’s Delight,vz
2637,11/5/2020 5:04:42 PM,7 5G ETFs to Invest In As the World Switches Over,vz
2638,11/5/2020 2:49:50 PM,Verizon +1.6% as J.P. Morgan upgrades to Overweight on growth acceleration,vz
2639,11/5/2020 2:00:00 PM,"The all-new iPhone 12 Pro Max and iPhone 12 mini with 5G, available to order from Verizon on 11/6",vz
2640,11/3/2020 10:10:45 PM,20 Election Stocks to Buy if Donald Trump Wins in 2020,vz
2641,11/2/2020 8:40:38 PM,"In telecom check-in, BofA likes wireless firms, data centers",vz
2642,11/2/2020 4:00:06 PM,Verizon supports military families now and always; gives best pricing to those who serve,vz
2643,11/2/2020 3:00:00 PM,Verizon 5G Ultra Wideband Helping New Jersey Small Businesses Rebound,vz
2644,10/30/2020 7:23:58 PM,Nokia Stock Gets Slammed Again,vz
2645,10/30/2020 5:02:16 PM,"With the Credibility Suck Impacting Nokia, You Should Stay Away From the Stock",vz
2646,10/30/2020 3:00:00 PM,Verizon’s ‘Full Transparency’ launches blockchain verification  for news releases,vz
2647,10/29/2020 5:55:33 PM,"Sustainable energy, heavy infrastructure on the ballot Nov. 3",vz
2648,10/29/2020 3:00:10 PM,Verizon gives customers more premium gaming experiences on the network built for gamers,vz
2649,10/29/2020 2:55:39 PM,Verizon expands 5G Home Internet to 12 cities,vz
2650,10/29/2020 2:00:10 PM,Verizon continues to expand 5G Home Internet to customers across the country,vz
2651,10/29/2020 12:06:16 AM,Verizon Response: South Central Ice Storm,vz
2652,10/28/2020 6:47:54 PM,Verizon Response: Western Wildfire Update,vz
2653,10/28/2020 4:48:39 PM,Verizon Business launches new wireless plans at $30-$50/line monthly,vz
2654,10/28/2020 2:30:10 PM,Verizon supports distance learning for 50K students in North Carolina,vz
2655,10/28/2020 2:00:10 PM,Verizon Business unveils new unlimited plans,vz
2656,10/28/2020 12:55:08 PM,7 Value Investing Strategies to Find the Market’s Best Bargains,vz
2657,10/28/2020 12:11:12 PM,There’s More Than Just Covid to the Spectacular Quibi Failure,vz
2658,10/27/2020 9:00:10 PM,Verizon Response: Tropical Storm Zeta,vz
2659,10/27/2020 5:55:47 PM,Increasing political texts colliding with stricter rules from wireless carriers,vz
2660,10/27/2020 2:30:10 PM,Verizon customers get more 5G value with TCL 10 5G UW for only $399,vz
2661,10/26/2020 9:01:09 PM,Verizon Is Not the Best 5G Play Right Now,vz
2662,10/26/2020 9:01:29 AM,5 Investment Winners From the Apple 5G iPhone 12 Announcement,vz
2663,10/24/2020 10:31:45 PM,AT&T's ax: Job cuts spin up to historical levels,vz
2664,10/23/2020 6:51:09 PM,Long-Term Investors Can Consider Investing in Nokia,vz
2665,10/23/2020 5:29:04 PM,3 Newly Recruited Dow Jones Stocks to Trade,vz
2666,10/22/2020 5:34:55 PM,3 5G Stocks to Buy for the Consumer Boom,vz
2667,10/22/2020 4:30:10 PM,"Yahoo Finance’s “All Markets Summit: Road to Recovery” Global Livestream Event Takes Place on Monday, October 26th at 9AM ET",vz
2668,10/22/2020 4:00:10 PM,Verizon and Generation partner to close the opportunity gap and reskill workers,vz
2669,10/22/2020 3:30:10 PM,Verizon Business offers managed Kubernetes service for edge and multi-cloud deployment,vz
2670,10/22/2020 3:26:24 PM,Verizon and Cooper Hewitt Call on Innovators to Create Interactive Museum Experiences,vz
2671,10/22/2020 3:03:05 PM,Verizon outperforming in today's slump as analysts weigh Q3 profit beat,vz
2672,10/22/2020 3:00:10 PM,“Shark Tank’s” Lori Greiner joins Verizon small business webinar series,vz
2673,10/21/2020 7:40:23 PM,Why Investors Should Be Upbeat About Exxon Mobil,vz
2674,10/21/2020 7:12:22 PM,"Why AT&T’s Dividend Appears Safe, For Now",vz
2675,10/21/2020 6:59:26 PM,Buy Nokia Stock Before the Company Resumes Dividends,vz
2676,10/21/2020 4:54:23 PM,10 Best Stocks for 2020: Megatrends Support This Year’s Biggest Winners,vz
2677,10/21/2020 1:30:10 PM,"Verizon reports strong Q3 financial results, increases guidance",vz
2678,10/21/2020 11:52:22 AM,"Verizon tops profit estimates on wireless, Fios strength; raises full-year profit view",vz
2679,10/21/2020 11:31:13 AM,"Verizon EPS beats by $0.03, misses on revenue",vz
2680,10/20/2020 8:48:55 PM,"5 Top Stock Trades for Wednesday: LOGI, PM, VZ, IRBT, ABT",vz
2681,10/20/2020 5:18:15 PM,"Verizon, Ericsson, Qualcomm hit 5.06 Gbps 5G speed",vz
2682,10/20/2020 5:12:01 PM,Verizon Q3 2020 Earnings Preview,vz
2683,10/20/2020 4:55:10 PM,"Verizon, Ericsson and Qualcomm first in the world to achieve 5G peak speed of 5.06 Gbps",vz
2684,10/20/2020 4:11:53 PM,Notable earnings before Wednesday's open,vz
2685,10/20/2020 3:01:35 PM,Here's what Wall Street expects from Verizon's earnings report,vz
2686,10/20/2020 3:00:10 PM,Verizon customers get access to rare Pokémon and avatar masks in new Pokémon GO deal,vz
2687,10/20/2020 1:30:10 PM,"Verizon Communications to report earnings October 21, 2020",vz
2688,10/20/2020 10:12:40 AM,Verizon Business Takes Private 5G Global,vz
2689,10/20/2020 8:22:06 AM,Verizon Business launches private 5G for international customers,vz
2690,10/19/2020 8:30:10 PM,Verizon Teams with Microsoft to Offer Private 5G Mobile Edge Computing,vz
2691,10/19/2020 8:01:39 PM,Verizon joins hands with Microsoft to offer 5G mobile edge computing,vz
2692,10/19/2020 4:30:10 PM,Verizon agrees to purchase Bluegrass Cellular,vz
2693,10/19/2020 3:00:10 PM,Social Security Administration Awards Verizon Contract for Enterprise-Wide Infrastructure Modernization,vz
2694,10/19/2020 2:46:46 PM,Verizon acquiring Bluegrass Cellular in Kentucky,vz
2695,10/18/2020 4:18:24 PM,Toshiba eyes $3B in quantum cryptography revenue by 2030,vz
2696,10/15/2020 9:00:10 PM,BlueJeans by Verizon Named a Visionary in Gartner Magic Quadrant for Meeting Solutions,vz
2697,10/15/2020 5:59:54 PM,5G Stocks: This New Era of Massive Profits Just Began,vz
2698,10/15/2020 4:00:10 PM,Verizon to offer motorola one 5G UW with 5G Ultra Wideband and 5G Nationwide capability,vz
2699,10/14/2020 9:40:38 PM,5G Opportunity: Apple Finally Hops on the 5G Bandwagon,vz
2700,10/14/2020 6:55:35 PM,Fastest 5G Network in the World Just Launched in San Francisco,vz
2701,10/14/2020 4:12:44 PM,Nokia Is Poised to Score After Setbacks,vz
2702,10/14/2020 1:00:10 PM, Fastest 5G Network in the World Just Launched in Baltimore,vz
2703,10/14/2020 1:00:10 PM,Fastest 5G Network in the World Just Launched in Hartford,vz
2704,10/14/2020 1:00:10 PM,Fastest 5G Network in the World Just Launched in Richmond,vz
2705,10/14/2020 1:00:10 PM,Fastest 5G Network in the World Just Launched in Syracuse,vz
2706,10/14/2020 1:00:10 PM,Fastest 5G Network in the World Just Launched in Oklahoma City,vz
2707,10/14/2020 1:00:10 PM,Fastest 5G Network in the World Just Launched in Sarasota,vz
2708,10/14/2020 1:00:10 PM, Fastest 5G Network in the World Just Launched in Anaheim,vz
2709,10/14/2020 1:00:10 PM, Fastest 5G Network in the World Just Launched in Las Vegas,vz
2710,10/14/2020 1:00:10 PM,Fastest 5G Network in the World Just Launched in Philadelphia,vz
2711,10/14/2020 1:00:10 PM,Fastest 5G Network in the World Just Launched in Tucson,vz
2712,10/14/2020 1:00:10 PM,Fastest 5G Network in the World Just Launched in Raleigh,vz
2713,10/14/2020 1:00:10 PM,Fastest 5G Network in the World Just Launched in Jersey City,vz
2714,10/14/2020 10:46:52 AM,Is Now Finally a Good Time to Buy AT&T Stock?,vz
2715,10/14/2020 8:51:43 AM,Carriers look to solidify customer base with iPhone deals,vz
2716,10/13/2020 10:40:52 PM,"A new era for iPhone with 5G, Verizon to offer iPhone 12 lineup, with orders starting on October 16",vz
2717,10/13/2020 7:57:31 PM,Fastest 5G Network in the World just got bigger and better,vz
2718,10/13/2020 6:45:17 PM,3 Key Takeaways From Apple’s iPhone 12 Event,vz
2719,10/13/2020 5:01:32 PM,The Overlooked 5G Opportunity Most Investors Are Missing,vz
2720,10/10/2020 10:33:35 PM,"U.S. pay TV revenue falling to $56B by 2025, research shows",vz
2721,10/9/2020 8:39:48 PM,Investing Strategy: Should You Invest In Value or Growth Stocks?,vz
2722,10/9/2020 8:25:26 PM,The Investor’s Guide to 5G Stocks,vz
2723,10/9/2020 7:00:01 PM,Seeking Alpha Catalyst Watch,vz
2724,10/9/2020 4:00:10 PM,Verizon to launch all-female lineup of virtual music events starting October 20,vz
2725,10/8/2020 7:25:08 PM,Verizon Response: Hurricane Delta,vz
2726,10/8/2020 3:00:10 PM,Verizon Accelerates 5G Research and Development with 5G Innovation Hub at University of Illinois Research Park,vz
2727,10/7/2020 11:09:13 PM,Investing at Different Stages of Life: Value vs Growth Investing,vz
2728,10/7/2020 9:56:26 PM,Verizon Response: Hurricane Delta,vz
2729,10/7/2020 9:41:03 PM,What Is 5G? Answer That Question and Upload Profits,vz
2730,10/7/2020 5:52:15 PM,What More Does Nokia Have to Do?,vz
2731,10/7/2020 3:00:22 PM,"Verizon, Cisco team up on sports/entertainment venue solutions",vz
2732,10/7/2020 2:00:10 PM,"Verizon Business and Cisco Bringing 5G-Enabled, MEC Solutions to Sports and Entertainment Venues",vz
2733,10/6/2020 5:21:37 PM,Clinton Foundation and Verizon partner to promote student social impact innovation,vz
2734,10/6/2020 4:30:10 PM,Verizon enhances communications for first responders with Push-to-Talk Responder,vz
2735,10/6/2020 3:15:10 PM,Verizon named official 5G and wireless partner of Prudential Center,vz
2736,10/6/2020 6:01:10 AM,Only 1 in 4 Global Organizations Keep Cardholder Payment Data Secure,vz
2737,10/5/2020 8:54:57 PM,Verizon announces accepted amounts of Old Notes and pricing terms of New Notes in connection with its separate private exchange offers for (i) 7 series of notes and (ii) 10 series of notes,vz
2738,10/5/2020 1:00:10 PM,Verizon announces early participation results of its separate private exchange offers for (i) 7 series of notes and (ii) 10 series of notes and upsize of the exchange offers,vz
2739,10/2/2020 7:55:09 PM,Roxanne S. Austin Elected to Verizon Board of Directors,vz
2740,10/1/2020 7:17:23 PM,12 5G Stocks to Buy for Election-Proof Results,vz
2741,10/1/2020 7:00:10 PM,"Verizon pledges another $250,000 of support for PFLAG",vz
2742,10/1/2020 6:30:10 PM,Healthcare Services Use BlueJeans by Verizon to Accelerate Telehealth Initiatives and Improve Patient Outcomes,vz
2743,10/1/2020 4:00:10 PM,Verizon Business to Debut Contact Center Hub,vz
2744,10/1/2020 3:30:10 PM,Verizon Fios adds new Spanish-language VOD content,vz
2745,10/1/2020 3:00:10 PM,Verizon expands LTE Home Internet to more rural areas,vz
2746,10/1/2020 10:40:36 AM,Nokia Stock Won’t Escape Geopolitics Forever,vz
2747,9/30/2020 8:30:10 PM,Pixel perfect: Verizon announces preorders for new Google Pixel 5 and Pixel 4a 5G UW,vz
2748,9/30/2020 2:46:06 PM,How to Supercharge Your Verizon Stock Dividend,vz
2749,9/29/2020 9:47:00 PM,Verizon Global Funding Corp. -- Moody's announces completion of a periodic review of ratings of Verizon Communications Inc.,vz
2750,9/29/2020 4:30:10 PM,Verizon first to carry awesome dual-screen LG Wing; preorders start October 1,vz
2751,9/29/2020 3:00:10 PM,"Yahoo Finance Announces All-Star Lineup for First-Ever Virtual “All Markets Summit: Road to Recovery” on Monday, October 26th at 9AM ET Hosted Live from the Nasdaq MarketSite",vz
2752,9/29/2020 3:00:10 PM,Verizon expands 5G Home Internet to Minneapolis & St. Paul customers; offers cutting-edge equipment,vz
2753,9/28/2020 3:00:10 PM,Verizon Business Survey Finds 55% of Small Businesses Concerned About Survival Amid Social Distancing Regulations,vz
2754,9/25/2020 4:24:34 PM,The 7 Best Stocks to Buy for the Fourth Quarter,vz
2755,9/25/2020 3:22:30 PM,Verizon Named Official 5G Partner of the National Hockey League,vz
2756,9/24/2020 10:38:10 PM,BlueJeans Streamlines Back-to-Office Planning with Cloud Video Interop for Microsoft Teams,vz
2757,9/24/2020 6:03:56 PM,"Bull Case Isn’t Broken For Nokia Stock, But Tread Carefully",vz
2758,9/24/2020 2:18:16 PM,Verizon commits $1 million to We Mean Business coalition to help scale climate action,vz
2759,9/24/2020 11:45:09 AM,The 5 Best 5G Stocks to Buy Right Now,vz
2760,9/23/2020 7:30:10 PM,Permissive 10-digit dialing to begin in Pennsylvania’s 814 Area Code,vz
2761,9/23/2020 7:20:22 PM,Verizon deploys remote network-connected drone during Big Hollow Wildfire,vz
2762,9/23/2020 6:05:10 PM,"Verizon Communications to report earnings October 21, 2020",vz
2763,9/23/2020 4:00:10 PM,Samsung Galaxy S20 FE 5G UW brings fan-favorite features to Verizon customers,vz
2764,9/23/2020 2:30:10 PM,The New Digital Workplace - Overcoming the Limits of Time and Place,vz
2765,9/23/2020 1:02:44 PM,China Mobile Stock Offers Both Income and Price Appreciation Potential,vz
2766,9/22/2020 7:14:06 PM,7 5G Stocks for the Next Communication Revolution,vz
2767,9/21/2020 11:00:36 PM,"Verizon announces separate private exchange offers for (i) 7 series of notes for up to $750 million of new notes and (ii) 10 series of notes for up to $2 billion of new notes and, if applicable, cash",vz
2768,9/21/2020 5:00:10 PM,Verizon says ‘NO’ to more than 7 billion robocalls and counting,vz
2769,9/21/2020 4:26:12 PM,Buy Comeback-Bound Nokia on This Dip,vz
2770,9/21/2020 2:30:10 PM,Verizon Convenes Second Citizen Verizon Assembly: Education is Not Up for Debate,vz
2771,9/21/2020 2:13:42 PM,XL Fleet SPAC Merger: Electric Truck Company to Go Public Via PIC SPAC,vz
2772,9/18/2020 6:17:15 PM,"Verizon Foundation commits $300,000 to West Coast wildfires and Hurricane Sally relief efforts",vz
2773,9/18/2020 3:00:10 PM,Verizon expands relationship with Amazon,vz
2774,9/18/2020 2:51:57 PM,Ericsson Wants to be the Carriers’ Qualcomm in 5G Race,vz
2775,9/17/2020 3:00:10 PM,Verizon expands connected device plans with Unlimited Plus; simplifies connected smartwatch options,vz
2776,9/16/2020 9:29:46 PM,Verizon prices second Green Bond,vz
2777,9/16/2020 3:30:10 PM,"Verizon, Corning and Samsung complete trials of new indoor cell sites to extend 5G coverage",vz
2778,9/16/2020 3:00:10 PM,Verizon Media Launches New Platform Capabilities Designed To Evolve The Live Streaming Experience,vz
2779,9/16/2020 11:07:01 AM,Comcast Bets a Cable Monopoly Can Be a Phone Company,vz
2780,9/15/2020 3:05:10 PM,‘Speed of Thought’ documentary highlights first wave of 5G visionaries,vz
2781,9/15/2020 2:30:10 PM,"Verizon Media brings premium, unified demand to publishers with OTT Smart Auction",vz
2782,9/15/2020 2:32:00 AM,"America Movil, S.A.B. de C.V. -- Moody's says Verizon's $6.25 billion acquisition of Tracfone does not impact ratings or positive outlook",vz
2783,9/15/2020 2:28:00 AM,Verizon Communications Inc. -- Moody's says Verizon's $6.25 billion acquisition of Tracfone does not impact ratings or positive outlook,vz
2784,9/14/2020 10:31:30 PM,Verizon Response: Hurricane Sally,vz
2785,9/14/2020 7:00:10 PM,"Verizon launches Verizon Latino, a Latin music destination on Apple Music",vz
2786,9/14/2020 7:00:10 PM,"Verizon launches Verizon Latino, a Latin music destination on Apple Music",vz
2787,9/14/2020 6:00:10 PM,The Paley Center for Media Strikes Historic Deal with Verizon,vz
2788,9/14/2020 2:00:10 PM,Verizon to acquire Tracfone,vz
2789,9/14/2020 1:26:30 PM,Verizon to speak at Goldman Sachs Communacopia Conference September 15,vz
2790,9/11/2020 2:32:00 PM,The 7 Best 5G Stocks to Buy Now for Long-Term Growth,vz
2791,9/10/2020 10:37:38 PM,Verizon Response: Unlimited call/text/data for customers impacted by Oregon wildfires,vz
2792,9/10/2020 3:45:10 PM,Verizon enables distance learning for up to 1.7M students in Oregon and Washington,vz
2793,9/9/2020 2:05:10 PM,New Inseego 5G MiFi hotspot delivers breakthrough performance on Verizon 5G Ultra Wideband network,vz
2794,9/8/2020 6:35:10 PM,"Verizon to speak at Media, Communications & Entertainment Conference September 9",vz
2795,9/8/2020 4:00:10 PM,"Verizon offers Marvel’s Avengers to new customers, skins to existing customers",vz
2796,9/8/2020 1:00:10 PM,Verizon recognized as leader in Managed SD WAN Services Worldwide in IDC MarketScape report,vz
2797,9/8/2020 12:00:10 PM,Verizon has America’s best network in the first RootMetrics testing to include 5G,vz
2798,9/7/2020 2:45:10 AM,Samsung scores $6.6B Verizon order for network equipment,vz
2799,9/3/2020 7:05:54 PM,Verizon increases dividend for 14th consecutive year,vz
2800,9/3/2020 3:00:10 PM,Verizon advances 5G network and cyber security,vz
2801,9/3/2020 3:00:10 PM,Verizon Achieves Milestone in Future-Proofing Data from Hackers,vz
2802,9/2/2020 3:00:10 PM,DISH Media partners with Verizon Media to automate addressable advertising,vz
2803,9/1/2020 4:00:10 PM,Verizon announces availability of innovative new Samsung Galaxy Z Fold2 5G and Tab S7 5G series,vz
2804,9/1/2020 2:00:10 PM,Verizon Media teams with Broadsign to extend programmatic omnichannel offering,vz
2805,8/31/2020 3:30:10 PM,Verizon provides expanded connectivity to Navajo Nation to aid in Covid-19 response,vz
2806,8/27/2020 11:17:16 PM,Verizon Foundation commits $1 million to Hurricane Laura relief efforts,vz
2807,8/27/2020 6:59:22 PM,Verizon Response: Update following Hurricane Laura’s Landfall,vz
2808,8/26/2020 3:38:34 PM,Verizon Response:  unlimited call/text/data for customers in Hurricane Laura’s Path,vz
2809,8/26/2020 3:00:10 PM,Verizon completes final allocation of its first Green Bond,vz
2810,8/26/2020 3:00:10 PM,Verizon signs new Renewable Energy Purchase Agreements bringing total to 840 MW of renewable energy,vz
2811,8/26/2020 2:30:10 PM,Verizon Expands Education Initiatives to Provide Millions of Students Nationwide with Distance Learning Resources,vz
2812,8/25/2020 6:00:10 PM,Verizon paves way for wide-scale 5G mobile edge compute with first successful end-to-end fully virtualized 5G data session in the world,vz
2813,8/25/2020 2:55:57 PM,7 Value Stocks to Buy For Growth and Peace of Mind,vz
2814,8/24/2020 5:30:47 PM,Verizon stands ready as storms approach the Gulf Coast,vz
2815,8/22/2020 2:16:07 AM,Verizon Response: Unlimited call/text/data for customers impacted by wildfires in California and Colorado,vz
2816,8/21/2020 4:04:40 PM,7 Safe Stocks to Buy That Can Shrug Off the Growing Volatility,vz
2817,8/21/2020 3:00:10 PM,Verizon 5G Ultra Wideband network brings unique experience to Indy 500 fans at home,vz
2818,8/21/2020 6:01:50 AM,"Verizon’s network stands ready to handle extreme heat, rolling power outages and wildfires",vz
2819,8/20/2020 6:38:30 PM,7 Penny Stocks to Buy Right Now As Trends Catalyze Opportunity,vz
2820,8/20/2020 2:00:10 PM,Texas Education Agency and Verizon enable distance learning for 18.9M students in 16 states,vz
2821,8/20/2020 2:00:10 PM,Massachusetts and Verizon enable distance learning for 4.7M more students,vz
2822,8/20/2020 12:16:08 PM,Dividend-Heavy Verizon Stock Is Shockingly Undervalued Right Now,vz
2823,8/19/2020 4:00:10 PM,Verizon becomes exclusive 5G partner of Twitch Rivals;  will help shape the future of gaming,vz
2824,8/18/2020 6:23:58 PM,Dial Up a Consistent Stream of Profits with Verizon Stock,vz
2825,8/18/2020 2:10:12 PM,5 Election Stocks for a Biden Presidency,vz
2826,8/17/2020 3:04:20 PM,"Verizon unlocks more value for customers with Disney+, Hulu, and ESPN+ included",vz
2827,8/13/2020 3:46:48 PM,"With Deals Galore, Ericsson Stock Looks Unsinkable Here",vz
2828,8/13/2020 3:27:22 PM,Investors Should Believe the 5G Hype For Nokia Stock,vz
2829,8/13/2020 3:00:10 PM,Verizon Business to create next-generation global network infrastructure for Bayer,vz
2830,8/13/2020 2:00:10 PM,"Verizon introduces hyper-precise location services, advancing road safety, autonomous technology",vz
2831,8/12/2020 10:57:00 PM,Verizon Owner Trust 2020-B -- Moody's assigns definitive ratings to Verizon Owner Trust 2020-B Notes,vz
