,time,headline,stock
3808,5/10/2018 4:00:00 PM,Aspen Dental Makes Access to Care Easier in Fremont,vz
3809,5/8/2018 11:59:17 PM,BRIEF-Verizon Files Pricing Term Sheet With U.S. SEC Related To $1.788 Bln Floating Rate Notes Due 2025,vz
3810,5/4/2018 8:24:51 PM,BRIEF-Verizon Files Pricing Term Sheet With U.S. SEC Related To Offering Of $730 Million 5.32% Notes Due 2053,vz
3811,5/4/2018 12:42:21 PM,BRIEF-Verizon Files Preliminary Prospectus Supplement Related To Potential Notes Offering,vz
3812,5/3/2018 6:24:16 PM,BRIEF-Verizon Says Shareholders Elected Each Of Co's 11 Directors To 1-Year Term,vz
3813,5/3/2018 6:22:40 PM,Verizon reports results of preliminary shareholder vote at 2018 annual meeting,vz
3814,5/2/2018 5:32:00 PM,Ketchum Named Creative Agency of the Year at North America SABRE Awards,vz
3815,5/1/2018 10:50:00 PM,PepsiCo Declares Quarterly Dividend,vz
3816,5/1/2018 10:05:00 PM,Horizon Technology Finance Announces First Quarter 2018 Financial Results,vz
3817,5/1/2018 9:41:00 PM,2018 Causeway Boat and Marine Show Sails Into Ft Pierce June 9-10,vz
3818,5/1/2018 7:13:10 PM,My Verizon App is now available en español,vz
3819,4/30/2018 3:30:00 PM,"Verizon collapses key network elements,  improving efficiency and customer functionalityWith Cisco and Juniper Networks, company combines existing edge routers  onto a single disaggregated platform",vz
3820,4/30/2018 9:51:00 AM,Deutsche Telekom International Finance B.V. -- Moody's affirms DT's ratings; changes outlook to negative following TMUS/Sprint merger,vz
3821,4/27/2018 6:30:00 PM,"Buzzing R&B Pop Newcomer Janine The Machine Releases Her Debut EP ""High Places"" Today",vz
3822,4/27/2018 6:13:09 PM,Verizon to donate up to $250K to Wounded Warrior Project on behalf of new wireless customer accounts in May,vz
3823,4/24/2018 6:23:40 PM,RPT-UPDATE 3-Verizon first-quarter results beat estimates,vz
3824,4/24/2018 5:40:05 PM,UPDATE 3-Verizon first-quarter results beat estimates,vz
3825,4/24/2018 2:53:21 PM,Verizon first-quarter results beat estimates,vz
3826,4/24/2018 1:53:48 PM,UPDATE 1-Verizon first-quarter results beat estimates,vz
3827,4/24/2018 1:44:04 PM,BRIEF-Verizon Communications Reports Q1 Earnings Per Share $1.11,vz
3828,4/24/2018 1:25:00 PM,Verizon begins 2018 with strong momentum,vz
3829,4/23/2018 1:25:00 PM,Verizon Communications to report earnings April 24,vz
3830,4/21/2018 2:57:06 AM,A small family-run firm bought Flickr from Verizon and says it can bring back its glory days (VZ),vz
3831,4/21/2018 2:34:21 AM,"UPDATE 5-U.S. said to investigate AT&T, Verizon over wireless collusion claim -source",vz
3832,4/21/2018 12:45:57 AM,"UPDATE 4-U.S. said to investigate AT&T, Verizon over wireless collusion claim -source",vz
3833,4/21/2018 12:09:57 AM,"UPDATE 3-U.S. said to investigate AT&T, Verizon over wireless collusion claim -source",vz
3834,4/20/2018 11:26:42 PM,"UPDATE 2-U.S. said to investigate AT&T, Verizon over wireless collusion claim -source",vz
3835,4/20/2018 10:36:41 PM,"UPDATE 1-DOJ said to investigate AT&T, Verizon over wireless collusion claim - source",vz
3836,4/20/2018 9:58:53 PM,"DOJ said to investigate AT&T, Verizon over wireless collusion claim - NYT",vz
3837,4/20/2018 9:52:34 PM,BRIEF-U.S. Said To Investigate AT&T And Verizon Over Wireless Collusion Claim - NYT,vz
3838,4/20/2018 4:55:00 PM,"Greenwich Capital Commercial Funding Corp., 2007-GG9 -- Moody's Affirms Six Classes of GCCFC 2007-GG9",vz
3839,4/19/2018 2:30:00 PM,Verizon Bolsters In-House Customer Experience Design Team with Acquisition of Moment ,vz
3840,4/18/2018 10:33:28 PM,Marissa Mayer blames short-sighted activist investors for causing Yahoo to lose out on tens of billions of dollars of upside by selling Alibaba stake (VZ),vz
3841,4/16/2018 3:00:00 PM,SPAM? Verizon gives you a new tool to avoid those pesky robocalls with new Caller ID feature,vz
3842,4/13/2018 8:05:58 PM,BRIEF-Verizon Communications Reports 9.3 Pct Passive Stake In Helios And Matheson Analytics,vz
3843,4/13/2018 6:00:00 PM,New Manufacturing Paradigm Solves MM-Wave Circuit Design Challenges,vz
3844,4/12/2018 3:30:00 PM,"Verizon Virtual Network Services Bundles Make Move to Virtualization Fast, Easy and Cost EffectiveBundles are currently available for SD WAN and network security and routing functions, with more to...",vz
3845,4/12/2018 9:34:00 AM,Sectra: Dutch Pathology Labs can now Communicate Through Nationwide Telepathology Solution,vz
3846,4/10/2018 6:01:00 AM,"Ransomware still a top cybersecurity threat, warns Verizon 2018 Data Breach Investigations Report",vz
3847,4/5/2018 11:30:10 PM,"Envrmnt launches AR Designer: intuitive platform makes it easy to add virtual experiences to mobile appsSmall businesses, large companies, governments can create augmented reality experiences...",vz
3848,4/5/2018 4:00:00 PM,Verizon takes industry lead in working with key partners to drive advancements on CBRS spectrum,vz
3849,4/5/2018 4:00:00 PM,Hatchery Works and Krish TechnoLabs Announce Strategic Partnership to Enhance B2B eCommerce Solutions,vz
3850,4/2/2018 3:00:00 PM,"A smart investment: five ways to protect your phone at home, on the road and abroad",vz
3851,4/2/2018 2:00:00 PM,Verizon announces expiration and final results of its tender offers for 13 series of notes,vz
3852,4/2/2018 1:00:00 PM,Verizon to Invest More Than $200 Million in STEM Education Pledges to Reach 5 Million Students in 5 YearsVerizon Innovative Learning to Give Schools Access to 5G; Calls on Public to Help Nominate...,vz
3853,3/28/2018 10:16:00 PM,"BNY Mellon to Host First Quarter 2018 Earnings Conference Call on Thursday, April 19",vz
3854,3/28/2018 7:34:00 PM,Podcast: Bankers Healthcare Group Releases Podcast Episode 3: '4 Don'ts of Medical Practice Marketing',vz
3855,3/28/2018 3:05:00 PM,TuneIn Appoints Juliette Morris Chief Marketing Officer,vz
3856,3/28/2018 2:30:00 PM,Verizon partner program evolves to better serve organizations around the globeUS Master Agent Model launched to improve the Partner experience,vz
3857,3/27/2018 3:00:00 PM,Verizon unveils public safety private corePublic safety agencies can also get nationwide preemption and mobile broadband priority services,vz
3858,3/27/2018 2:00:00 PM,"Reich Brothers Announces Purchase of State-of-the-Art Panasonic Manufacturing Facility in Salem, OR",vz
3859,3/27/2018 1:35:40 PM,Verizon Risk Report Transforms Security Decision MakingRisk assessment framework enables better security decisions based on unparalleled cyber-threat data,vz
3860,3/26/2018 11:28:00 PM,"Cohen & Steers Limited Duration Preferred and Income Fund, Inc. (LDP) Notification of Sources of Distribution Under Section 19(a)",vz
3861,3/20/2018 1:30:00 PM,Freshpet® Kicks Off 'Fresh Start' Movement To Help Underdogs In Need,vz
3862,3/19/2018 9:05:59 PM,"Verizon announces increase to waterfall cap, accepted amounts and pricing terms of its tender offers for 13 series of notes",vz
3863,3/19/2018 8:15:00 PM,Pam Misialek Joins the Njevity Team as Director of Cloud Applications,vz
3864,3/19/2018 3:00:00 PM,"Verizon Finishes 2017 with Highest Customer LoyaltySays Thanks with New Reward Experiences Featuring Justin Timberlake, Luke Bryan, Demi Lovato and Maroon 5",vz
3865,3/19/2018 1:00:00 PM,"Verizon announces increase to waterfall cap, early participation results, and early settlement for tender offers for 13 series of notes",vz
3866,3/16/2018 7:30:00 PM,Verizon Completes Successful Test of Cisco’s Hybrid Information-Centric Networking in its Network,vz
3867,3/15/2018 3:06:33 PM,Verizon launches TechSure to help protect your digital life,vz
3868,3/15/2018 11:49:45 AM,"Verizon and Colt demonstrate industry-first, two-way inter carrier SDN network orchestrationThe companies have successfully showcased near-real-time bandwidth changes in each other's production...",vz
3869,3/9/2018 7:56:03 PM,Trade in your old phone at Verizon and you can help schools get up to $4 million in tech resourcesVerizon will donate $1 per trade-in up to $4 million to DonorsChoose.org to help provide tech and...,vz
3870,3/7/2018 10:10:00 PM,"Frontier Communications Corporation -- Moody's affirms Frontier's B3 corporate family rating, outlook changed to stable",vz
3871,3/7/2018 12:41:55 AM,3/6/18: Verizon declares quarterly dividend,vz
3872,3/6/2018 2:00:00 PM,Verizon to speak at Deutsche Bank conference March 7,vz
3873,3/5/2018 10:19:32 PM,Verizon announces tender offers for 13 series of notes,vz
3874,3/5/2018 9:54:00 PM,Verizon Communications Inc. -- Moody's: Tax overhaul will boost cash flows for AT&T and Verizon,vz
3875,3/5/2018 9:51:00 PM,Moody's: Tax overhaul will boost cash flows for AT&T and Verizon,vz
3876,3/1/2018 6:01:00 AM,"AT&T, Sprint, T-Mobile and Verizon unveil next-generation mobile authentication platform details",vz
3877,2/28/2018 10:11:25 PM,"Verizon, Straight Path pay $614 million civil penalty to U.S. FCC: statement",vz
3878,2/27/2018 4:30:00 PM,Verizon and CONCACAF kick off exclusive multi-platform media partnershipSoccer fans across the U.S. can now access Scotiabank CONCACAF Champions League and more than 15 other tournaments via...,vz
3879,2/26/2018 5:00:00 PM,Verizon CFO to speak at Morgan Stanley conference Feb. 27,vz
3880,2/25/2018 6:30:00 PM,Introducing the Samsung Galaxy S9 on Verizon – the best streaming network meets a revolutionary Infinity DisplayPreorder your Galaxy S9 or Galaxy S9+ on Verizon starting March 2 and save up to $500*,vz
3881,2/21/2018 1:00:00 PM,New Verizon study reveals many organizations prioritized business performance at the cost of mobile enterprise securityNearly a third of organizations surveyed admitted to knowingly sacrificing...,vz
3882,2/19/2018 8:00:00 PM,Verizon engineers partner with NAF to visit dozens of high schools across the country to celebrate National Engineers Week,vz
3883,2/16/2018 6:25:00 PM,"Equinix, Inc. -- Moody's says Equinix's Infomart acquisition will not impact its Ba3 rating or positive outlook",vz
3884,2/15/2018 3:00:00 PM,Enterprises gain network and mobile device insights with Managed Software Defined Wireless Local Area Network from VerizonVerizon uses Mist Systems’ wireless artificial intelligence to speed WLAN...,vz
3885,2/13/2018 5:00:00 PM,2018’s Best Resolution: Netflix on 100% Fiber-optic Verizon FiosNetflix access now available via Fios TV channel 838; Verizon launches one-year free Netflix offer,vz
3886,2/12/2018 11:56:45 PM,"Another step toward mobile 5G service: Verizon, Nokia and Qualcomm complete first call using 3GPP-compliant  5G New Radio technologySuccessful over-the-air test completed on Verizon’s millimeter...",vz
3887,2/7/2018 3:00:00 PM,"Groundbreaking Docu-Series ""QB1: Beyond the Lights"" Returns for Season 2 on February 28",vz
3888,2/7/2018 6:10:00 AM,RootMetrics® ranks Verizon’s network #1 in the nation for a record ninth time in a row,vz
3889,2/5/2018 2:00:00 PM,"Shhh: Verizon network engineers quietly worked behind the scenes at Super Bowl LII to test the limits of 5G""Virtual sky box"" demonstration used multi-stream immersive virtual reality and video over...",vz
3890,2/5/2018 2:43:18 AM,First Responders are the Champions in Verizon Super Bowl SpotJustin Timberlake and Verizon Call on Viewers to Share Their Own Thanks and Donate at AllOurThanks.com,vz
3891,2/1/2018 10:15:00 PM,Henry Schein Animal Health To Showcase Products And Solutions And Host Live Events During VMX 2018,vz
3892,2/1/2018 9:45:00 PM,"Verizon carries successful data session on new NB-IoT Guard band networkComplementing Verizon’s robust nationwide IoT network offerings, new Narrowband IoT network will provide more choices for...",vz
3893,2/1/2018 3:30:00 PM,"Customers rate Verizon network experience #1 for a record 20th time in a rowJ.D. Power study gives Verizon more awards than any other wireless provider, marking 10 years of leadership in network...",vz
3894,1/31/2018 10:30:00 PM,"Verizon partners with New York State to deploy high-speed broadband to 15,500 rural households",vz
3895,1/31/2018 2:38:00 PM,Complimentary eBook Chapter Describes How Healthcare Organizations Use Intervenability to Drive Engagement,vz
3896,1/26/2018 4:30:00 PM,Verizon marks technical milestone with new high-capacity circuit emulation architectureCisco circuit emulation solution ups bit rate capability to OC-192,vz
3897,1/25/2018 4:30:00 PM,Verizon marks milestone with successful 400G technology trialInteroperability field trial used standards-compliant Ciena and Juniper Networks equipment,vz
3898,1/25/2018 3:30:00 PM,Verizon Enterprise Solutions expands virtual network services portfolio to include session border controller as a serviceVirtual Network Services – SBCaaS enhances Verizon’s software-defined...,vz
3899,1/25/2018 12:04:00 AM,"Cohen & Steers Quality Income Realty Fund, Inc. (RQI) Notification of Sources of Distribution Under Section 19(a)",vz
3900,1/24/2018 6:30:00 AM,Verizon Telematics Continues European Expansion with its Acquisition of Movildata Internacional,vz
3901,1/23/2018 2:32:20 PM,"Verizon quarterly profit jumps, helped by tax reform",vz
3902,1/23/2018 1:00:00 PM,"Verizon closes 2017 with strong wireless customer growth and retention, well-positioned in new markets",vz
3903,1/23/2018 12:00:00 PM,"Marken Opens New Location In Stuttgart, Germany",vz
3904,1/22/2018 1:00:00 PM,Verizon Communications to report earnings January 23,vz
3905,1/18/2018 4:00:00 PM,Permissive 10-digit dialing to begin in New Jersey’s 609 and 856 Area Codes,vz
3906,1/18/2018 12:28:30 AM,Verizon says new U.S. tax law to increase fourth-quarter earnings,vz
3907,1/17/2018 5:30:00 PM,"Verizon and NBA expand multi-platform content and technology partnership with new innovation componentYahoo Sports to provide access to live NBA League Pass games in the U.S. as well as highlights,...",vz
3908,1/17/2018 4:19:00 PM,Cablevision Systems Corporation -- Moody's assigns Ba1 to CSC Holding's proposed term loan and notes,vz
3909,1/17/2018 4:17:00 PM,"Cablevision Systems Corporation -- Moody's downgrades Cablevision's secured debt rating to Ba2, following the upsize to $2.5 b",vz
3910,1/16/2018 9:18:50 PM,"Blizzard of snaps, streams and shares forecast for Super Bowl LIIVerizon boosts network capacity by 500 percent in Minneapolis/Saint Paul for football fandom",vz
3911,1/16/2018 6:00:00 PM,Verizon Joins Linux Foundation's Open Network Automation Platform Project as Platinum Member,vz
3912,1/12/2018 10:06:00 PM,"Neptune Finco Corp. -- Moody's downgrades Cablevision's secured debt rating to Ba2, following the upsize to $2.5 b",vz
3913,1/11/2018 11:19:00 PM,"CSC Holdings, LLC -- Moody's assigns Ba1 to CSC Holding's proposed term loan and notes",vz
3914,1/9/2018 3:00:00 PM,Jack Morton Worldwide Appoints First Chief People Officer,vz
3915,1/8/2018 5:45:00 PM,Verizon chief technology officer to speak at Citi conference Jan. 9,vz
3916,1/5/2018 10:00:49 PM,"Verizon removes Bloomberg TV, refusing to pay carriage fees",vz
3917,1/5/2018 8:52:48 PM,Verizon acquires Niddel to add security detection and response capabilities for business customers,vz
3918,1/5/2018 5:52:00 PM,LB-UBS Commercial Mortgage Trust 2004-C4 -- Moody's Affirms Two Classes of LBUBS 2004-C4,vz
3919,1/3/2018 4:30:00 PM,Verizon and A+E Networks® expand partnership across Verizon’s family of media brandsPartnership Includes Access to Premium Programming Including First-Look Content,vz
3920,1/2/2018 7:02:03 AM,PRESS DIGEST- New York Times business news - Jan 2 (VZ),vz
3921,12/27/2017 6:25:00 PM,"Verizon, Qualcomm, and Ericsson collaborate to trial latest Massive MIMO advancements, on the path to 5G",vz
3922,12/22/2017 4:00:00 PM,"Crunch Franchise Announces Its Newest Location In Seminole, FL",vz
3923,12/22/2017 1:02:04 PM,"RPT-Wall St Week Ahead-This year's lumps of coal could be 2018's diamonds (GE, VRTX, ILMN, KR, AMZN, VZ, IBM, XOM, BA, CAT, CSCO, PFE, CVX, MRK, KO, PG, NKE, VRSN, EMR, ROK)",vz
3924,12/22/2017 7:02:03 AM,"Wall St Week Ahead-This year's lumps of coal could be 2018's diamonds (GE, VRTX, ILMN, KR, AMZN, VZ, IBM, XOM, BA, CAT, CSCO, PFE, CVX, MRK, KO, PG, NKE, VRSN, EMR, ROK)",vz
3925,12/20/2017 4:22:03 PM,"US STOCKS-Wall St takes a breather as tax bill nears passage (T, VZ, JPM, BAC, FDX, MU, AMAT, LRCX)",vz
3926,12/19/2017 10:08:00 PM,"Equinix, Inc. -- Moody's says Equinix's Metronode acquisition will not impact its Ba3 rating or positive outlook",vz
3927,12/19/2017 9:12:05 PM,"BRIEF-U.S. business borrowing for equipment rises 17 pct in Nov. - ELFA (VZ, VOLV , SIE, DE, CIT, CAT, BBT, BAC, 7751)",vz
3928,12/19/2017 9:02:03 PM,"U.S. business borrowing for equipment rises 17 pct in Nov - ELFA (BAC, BBT, CIT, CAT, DE, VZ, SIE, 7751, VOLV )",vz
3929,12/16/2017 1:22:03 AM,"UPDATE 1-U.S. Senate Democrats to force vote on FCC net neutrality repeal (T, VZ, CMCSA)",vz
3930,12/15/2017 10:37:04 PM,"U.S. Senate Democrats to force vote on FCC net neutrality repeal (T, VZ, CMCSA)",vz
3931,12/15/2017 5:32:03 PM,"U.S. internet rule change leaves major streaming companies unscathed for now (CMCSA, VZ, NFLX, AMZN, AKAM, TWX)",vz
3932,12/15/2017 3:38:00 PM,"Truck Drivers Honored with Holiday Dinner and Free Concert from Country Music Association (CMA) ""Vocal Duo of the Year"" Brothers Osborne",vz
3933,12/14/2017 11:03:03 PM,"The FCC repealed net neutrality — and cable companies fell (CMCSA, TMUS, TWX, S, VZ, CHTR)",vz
3934,12/14/2017 7:22:05 PM,"US STOCKS-S&P, Dow flat as healthcare losses offset by tech, media gains (DIS, NFLX, CMCSA, JNJ, VZ, T, CTL)",vz
3935,12/14/2017 7:17:04 PM,"U.S. Federal Communications Commission votes to repeal net neutrality rules (T, VZ, CMCSA)",vz
3936,12/14/2017 7:12:08 PM,"U.S. FCC meeting briefly evacuated ahead of net neutrality vote (T, VZ, CMCSA)",vz
3937,12/14/2017 5:42:05 PM,"US STOCKS-Wall St higher on optimism over tax bill, Fed's economic outlook (GS, JPM, BAC, DIS, AMZN, VZ, T, CTL)",vz
3938,12/14/2017 4:07:04 PM,"UPDATE 1-U.S. Federal Communications Commission set to reverse net neutrality rules (T, CMCSA, VZ)",vz
3939,12/14/2017 4:07:03 PM,"US STOCKS-Wall Street climbs as tax reform enters last lap (DIS, GS, JPM, WFC, BAC, AMZN, VZ, T, S)",vz
3940,12/14/2017 3:46:00 PM,Verizon completes purchase of fiber network infrastructure in Chicago market,vz
3941,12/14/2017 2:42:07 PM,BRIEF-Teresa Elder Joins WideOpenWest As CEO (VZ),vz
3942,12/14/2017 2:00:00 PM,Verizon announces final results of its tender offers / consent solicitations for 31 series of Verizon and certain of its subsidiaries' notes,vz
3943,12/14/2017 12:02:03 PM,"U.S. Federal Communications Commission set to reverse net neutrality rules (T, CMCSA, VZ)",vz
3944,12/13/2017 6:15:00 PM,Moody's: Some consumer ABS sectors to have weaker collateral performance due to pockets of borrower stress and weaker underwriting,vz
3945,12/13/2017 1:09:00 AM,Verizon offers data relief for customers impacted by Thomas Fire,vz
3946,12/12/2017 10:07:00 PM,"Go Wireless Holdings -- Moody's assigns first-time ratings to Go Wireless Holdings, Inc.; CFR at B1",vz
3947,12/12/2017 3:00:00 PM,"Verizon Opens 5G Incubator in the Heart of NYC's 'Silicon Alley,' Announces Initial Participants",vz
3948,12/12/2017 1:30:00 PM,"Deloitte TMT Predictions: Machine Learning Deployments, Digital Subscriptions, Smartphone Usage, On-Demand Content and Live Events Will Continue to Drive Growth",vz
3949,12/12/2017 7:02:03 AM,"PRESS DIGEST -Wall Street Journal - Dec 12 (Y92, CMCSA, DIS, VZ)",vz
3950,12/12/2017 6:01:00 AM,"Employers Report Strong Hiring across Many Markets, Driven by Uptick in Asia Pacific, U.S. and Eastern Europe",vz
3951,12/11/2017 10:32:03 PM,"U.S. agency prepares to hand over internet oversight to FTC (T, CMCSA, VZ)",vz
3952,12/11/2017 8:52:05 PM,"BRIEF-Verizon Awards 5G Contract To Ericsson (ERIC , VZ)",vz
3953,12/11/2017 7:02:09 PM,"UPDATE 1-Hackers hit U.S., Russian banks in ATM robbery scam-report (MSFT, VZ)",vz
3954,12/11/2017 6:54:55 PM,Verizon to pay $2.25 billion to NFL for five-year streaming deal: source,vz
3955,12/11/2017 4:07:04 PM,"Hackers hit major ATM network after U.S., Russian bank breaches -report (MSFT, VZ)",vz
3956,12/11/2017 3:12:06 PM,UPDATE 1-Verizon to pay $2.25 bln to NFL for 5-year streaming deal- source (VZ),vz
3957,12/11/2017 2:27:03 PM,BRIEF-NFL And Verizon Announce Partnership To Distribute Mobile Access To Live NFL Games (VZ),vz
3958,12/11/2017 2:02:03 PM,Verizon and NFL reach digital streaming agreement (VZ),vz
3959,12/11/2017 2:00:00 PM,NFL and Verizon Announce Game-Changing Partnership to Distribute Unprecedented Mobile Access to Live NFL Games,vz
3960,12/8/2017 1:32:03 AM,"BRIEF-Verizon - Customers In Southern California Areas Hardest Hit By Wildfires Will Be Offered Free Unlimited Talk, Text And Data from Dec 7-Dec 10 (VZ)",vz
3961,12/8/2017 1:02:00 AM,Verizon offers data relief for customers in areas impacted by Southern CA wildfires,vz
3962,12/7/2017 6:47:04 PM,BRIEF-Verizon Communications Sets Quarterly Dividend Of $0.59 Per Share (VZ),vz
3963,12/7/2017 6:34:00 PM,12/7/17: Verizon declares quarterly dividend,vz
3964,12/6/2017 6:30:00 PM,Verizon network technology executive to speak at Barclays conference Dec. 7,vz
3965,12/6/2017 3:21:03 PM,"Mozilla says Yahoo never delivered on its search deal and caused Firefox usage to decline — now they're both suing each other (VZ, AABA)",vz
3966,12/6/2017 3:00:00 PM,Astellas Pharma Chooses Verizon Secure Cloud Interconnect to Centralize Global Cloud Connectivity,vz
3967,12/5/2017 3:00:00 PM,Cocoon Biotech Appoints Dr. Annalisa Jenkins as Executive Chair of the Board,vz
3968,12/5/2017 12:52:04 PM,BRIEF-Wex Inc Announced Three-Year Fleet Card Contract With Verizon (VZ),vz
3969,12/5/2017 6:48:00 AM,"Equinix, Inc. -- Moody's assigns B1 to Equinix's proposed notes",vz
3970,12/4/2017 11:07:04 PM,"UPDATE 1-Fox prefers Disney as buyer for studio, media assets -Bbg (DIS, CMCSA, VZ)",vz
3971,12/4/2017 10:37:04 PM,"Fox prefers Disney as buyer for studio, media assets - Bbg (DIS, CMCSA, VZ)",vz
3972,12/4/2017 5:32:03 PM,"Tech consortium flags 40,000 videos, images as extremist content (MSFT, VZ)",vz
3973,12/4/2017 4:02:04 PM,"GRAPHIC-Lower taxes, big gains: The stocks poised to win from tax cuts (ZION, MTB, CMA, UNP, ALK, LUV, ABC, HCA, AFAM, DGX, ESRX, M, JWN, KSS, ROST, T, VZ)",vz
3974,12/4/2017 11:00:00 AM,Verizon CFO Matt Ellis to speak at UBS conference Dec. 5,vz
3975,12/1/2017 11:02:03 PM,"GRAPHIC-Lower taxes, big gains: The stocks poised to win from tax cuts (ZION, MTB, CMA, UNP, ALK, LUV, ABC, HCA, AFAM, DGX, ESRX, M, JWN, KSS, ROST, T, VZ)",vz
3976,12/1/2017 10:32:03 PM,"U.S. tax debate employing more than half of Washington's lobbyists -report (CMCSA, VZ, MSFT, MO)",vz
3977,12/1/2017 6:08:00 PM,Citigroup Commercial Mortgage Trust 2016-P6 -- Moody's Affirms Ten Classes of CGCMT 2016-P6,vz
3978,12/1/2017 7:02:03 AM,"PRESS DIGEST -Wall Street Journal - Dec 1 (VZ, CVS, AET, VOW3, DIS)",vz
3979,12/1/2017 12:33:06 AM,Verizon plans to offer wireless home internet access starting next year — and it could shake up the broadband market (VZ),vz
3980,11/30/2017 10:52:04 PM,BRIEF-Verizon Announces Pricing Terms Of Its Tender Offers (VZ),vz
3981,11/30/2017 10:44:00 PM,Verizon announces pricing terms of its tender offers / consent solicitations for 31 series of Verizon and certain of its subsidiaries' notes,vz
3982,11/30/2017 9:00:00 PM,Rabobank Announces 2017 Food and Agribusiness Industry Leadership Awards,vz
3983,11/30/2017 6:53:00 PM,Verizon plan to launch 5G broadband lifts shares,vz
3984,11/30/2017 3:30:00 PM,"Verizon Enterprise Solutions introduces Virtual Network Services - One: simplified pricing for hardware, software and management services",vz
3985,11/30/2017 2:17:03 PM,BRIEF-Verizon Announces Extension Of Early Participation Date And Early Results Of Its Tender Offers (VZ),vz
3986,11/30/2017 2:07:03 PM,BRIEF-Verizon Announces Extension Of Early Participation Date (VZ),vz
3987,11/30/2017 2:00:00 PM,Verizon announces extension of early participation date and early results of its tender offers / consent solicitations for 31 series of Verizon and certain of its subsidiaries' notes,vz
3988,11/29/2017 10:17:03 PM,BRIEF-Verizon To Launch 5G Residential Broadband Services In Up To 5 Markets In 2018 (VZ),vz
3989,11/29/2017 10:09:00 PM,Verizon to launch 5G residential broadband services in up to 5 markets in 2018,vz
3990,11/29/2017 9:32:04 PM,"LPC: Meredith’s Time buy helps lift US media lending to 11-yr high (MDP, CHTR, NFLX, AMZN, CMCSA, VZ, DIS, T)",vz
3991,11/29/2017 5:52:03 PM,"UPDATE 1-U.S. Supreme Court weighs major digital privacy case (VZ, T, S)",vz
3992,11/29/2017 1:02:03 PM,"RPT-U.S. Supreme Court weighs major digital privacy case (VZ, T, S)",vz
3993,11/29/2017 7:02:11 AM,"U.S. Supreme Court weighs major digital privacy case (VZ, T, S)",vz
3994,11/29/2017 1:57:08 AM,Canadian charged in Yahoo hacking case pleads guilty in U.S. (VZ),vz
3995,11/28/2017 9:47:03 PM,"UPDATE 1-U.S. FCC's Pai, addressing internet rules, calls Twitter biased (T, CMCSA, VZ)",vz
3996,11/28/2017 12:22:03 AM,"Internet businesses ask U.S. to keep net neutrality rules (T, CMCSA, VZ)",vz
3997,11/27/2017 8:32:03 PM,Tumblr founder David Karp to step down (VZ),vz
3998,11/27/2017 7:51:03 PM,Tumblr founder and CEO David Karp is resigning (VZ),vz
3999,11/25/2017 12:22:03 AM,Canadian charged in Yahoo hacking case to plead guilty in U.S. (VZ),vz
4000,11/23/2017 1:42:05 AM,"GLOBAL MARKETS-Dollar dumped, bonds boosted on Fed inflation caution (VZ, T)",vz
4001,11/22/2017 10:52:03 PM,"Q&A-Explaining the fight over U.S. 'net neutrality' regulations (T, CMCSA, VZ, AMZN, NFLX, MSFT)",vz
4002,11/22/2017 10:32:03 PM,"GLOBAL MARKETS-Stocks scale fresh record high, crude oil gains (, UKX, AAPL, AMZN, VZ)",vz
4003,11/22/2017 10:17:03 PM,"US STOCKS-Wall St flat ahead of holiday; ISPs rise on net neutrality bets (VZ, T, HPQ, QCOM, AVGO, DE)",vz
4004,11/22/2017 9:47:03 PM,"US STOCKS-Wall St flat in low volume session; ISPs rise on net neutrality bets (VZ, T, HPQ, QCOM, AVGO, DE)",vz
